bookID,title,authors,average_rating,isbn,isbn13,language_code,  num_pages,ratings_count,text_reviews_count,publication_date;;
8510,Who Was Thomas Jefferson?,Dennis Brindell Fradin/Nancy Harrison/John   O'Brien,4.07,0448431459,9780448431451.0,eng,103.0,692.0,80.0,7/28/2003;;
8515,The Man Who Listens to Horses,Monty Roberts/Lucy Grealy/Lawrence Scanlan,4.12,034542705X,9780345427052.0,en-US,352.0,9963.0,206.0,11/28/1998;;
8520,Under Orders (Sid Halley  #4),Dick Francis,3.87,0399154000,9780399154003.0,eng,308.0,4119.0,252.0,10/1/2006;;
8522,For Kicks,Dick Francis,4.0,0425194981,9780425194980.0,eng,292.0,3062.0,94.0,2/3/2004;;
8523,Forfeit,Dick Francis,3.94,0425201910,9780425201916.0,eng,256.0,2538.0,63.0,4/5/2005;;
8525,Dead Cert,Dick Francis,3.97,0425194973,9780425194973.0,eng,277.0,4964.0,124.0,1/6/2004;;
8528,Rat Race,Dick Francis,3.98,0425210766,9780425210765.0,eng,304.0,2400.0,93.0,7/5/2006;;
8529,Reflex,Dick Francis,4.07,0425206955,9780425206959.0,eng,304.0,4675.0,129.0,10/4/2005;;
8532,Decider,Dick Francis,3.99,042519938X,9780425199381.0,eng,341.0,3461.0,133.0,12/7/2004;;
8533,Slay Ride,Dick Francis,3.82,0425196739,9780425196731.0,en-US,288.0,2215.0,60.0,4/6/2004;;
8536,Bonecrack,Dick Francis,4.0,0425208850,9780425208854.0,eng,304.0,2910.0,84.0,6/6/2006;;
8537,Nerve,Dick Francis,4.04,0515123463,9780515123463.0,eng,320.0,3581.0,113.0,9/1/1998;;
8538,Break In (Kit Fielding  #1),Dick Francis,4.05,0425199932,9780425199930.0,eng,320.0,3758.0,128.0,1/4/2005;;
8540,Blood Sport,Dick Francis,3.89,0425199169,9780425199169.0,eng,288.0,4600.0,113.0,11/2/2004;;
8541,Straight,Dick Francis,4.05,042520846X,9780425208465.0,eng,320.0,3513.0,143.0,2/7/2006;;
8542,10 lb Penalty,Dick Francis,3.9,042519745X,9780425197455.0,eng,320.0,3490.0,177.0,8/3/2004;;
8544,Trial Run,Dick Francis,3.83,0425199835,9780425199831.0,eng,272.0,2004.0,54.0,9/7/2004;;
8545,Wild Horses,Dick Francis,3.91,0425196747,9780425196748.0,eng,352.0,2935.0,154.0,5/4/2004;;
8546,Field of Thirteen,Dick Francis,3.73,042519499X,9780425194997.0,eng,304.0,2053.0,85.0,3/2/2004;;
8548,Driving Force,Dick Francis,3.96,0449221393,9780449221396.0,eng,384.0,2635.0,107.0,12/29/1993;;
8551,Flying Finish,Dick Francis,3.97,0515125601,9780515125603.0,eng,276.0,2587.0,89.0,8/1/1999;;
8552,Bolt (Kit Fielding  #2),Dick Francis,4.04,0425202887,9780425202883.0,eng,288.0,5043.0,121.0,5/3/2005;;
8557,Come to Grief (Sid Halley  #3),Dick Francis,4.01,0425207188,9780425207185.0,eng,384.0,3786.0,134.0,12/6/2005;;
8559,Enquiry,Dick Francis,3.96,0425197050,9780425197059.0,en-US,272.0,96.0,4.0,7/6/2004;;
8568,Odds Against (Sid Halley  #1),Dick Francis,4.06,0425198006,9780425198001.0,eng,288.0,3749.0,130.0,2/1/2005;;
8572,Banker,Dick Francis,4.06,0718132386,9780718132385.0,eng,288.0,3092.0,132.0,10/3/2000;;
8574,Whip Hand (Sid Halley  #2),Dick Francis,4.1,0425203549,9780425203545.0,eng,304.0,5108.0,143.0,6/7/2005;;
8581,A Jockey's Life: The Biography of Lester Piggott,Dick Francis,3.59,0449213307,9780449213308.0,eng,468.0,82.0,2.0,7/12/1987;;
8582,The Dick Francis Treasury of Great Racing Stories,Dick Francis/John Welcome,3.79,0449220494,9780449220498.0,eng,221.0,64.0,3.0,3/22/1992;;
8583,Come to Grief / Decider / Wild Horses,Dick Francis,4.09,0399143068,9780399143069.0,eng,707.0,32.0,0.0,11/10/1997;;
8586,Odds Against,Dick Francis,4.06,0515125512,9780515125511.0,eng,277.0,56.0,4.0,4/1/2000;;
8598,Eats  Shoots & Leaves: Why  Commas Really Do Make a Difference!,Lynne Truss/Bonnie Timmons,4.15,0399244913,9780399244919.0,eng,32.0,1371.0,205.0,7/25/2006;;
8601,Talk to the Hand: The Utter Bloody Rudeness of Everyday Life,Lynne Truss,3.33,1861979339,9781861979339.0,eng,214.0,204.0,30.0,10/24/2005;;
8614,The Spice and Herb Bible,Ian Hemphill/Kate Hemphill,4.25,0778801462,9780778801467.0,eng,606.0,155.0,16.0,9/14/2006;;
8627,Master and Commander (Aubrey/Maturin   #1),Patrick O'Brian,4.1,0393325172,9780393325171.0,en-US,459.0,541.0,95.0,10/17/2003;;
8628,The Making of Master and Commander: The Far Side of the World,Tom McGregor,3.97,0393325539,9780393325539.0,eng,168.0,96.0,13.0,10/17/2003;;
8630,The Ionian Mission (Aubrey/Maturin  #8),Patrick O'Brian/Simon Vance,4.32,0786177837,9780786177837.0,eng,10.0,3659.0,80.0,10/1/2005;;
8632,Her Master and Commander (Just Ask Reeves  #1),Karen Hawkins,3.8,0060584084,9780060584085.0,eng,372.0,799.0,31.0,2/28/2006;;
8643,Strange Sounds: Music  Technology & Culture,Timothy D. Taylor,3.77,0415936845,9780415936842.0,eng,278.0,26.0,0.0,10/14/2001;;
8645,Stanley Park,Timothy  Taylor,3.57,1582432902,9781582432908.0,eng,436.0,1818.0,89.0,9/25/2003;;
8646,Crow Lake,Mary Lawson,3.88,0385337639,9780385337632.0,eng,324.0,14109.0,1591.0,1/13/2003;;
8648,Xenocide (Ender's Saga  #3),Orson Scott Card/Piotr W. Cholewa,3.79,0312861877,9780312861872.0,eng,592.0,119937.0,3139.0,7/15/1996;;
8656,The Life of Sir Arthur Conan Doyle,John Dickson Carr/Daniel Stashower,4.01,0786712341,9780786712342.0,eng,320.0,148.0,6.0,11/11/2003;;
8660,The Lost World (TV Tie-in),Arthur Conan Doyle/Philip Gooden,3.92,0142002720,9780142002728.0,eng,224.0,18.0,4.0,9/3/2002;;
8661,Las aventuras de Sherlock Holmes,Arthur Conan Doyle/Javier Gomez Rea,4.33,8497643658,9788497643658.0,eng,192.0,116.0,11.0,4/1/2005;;
8675,Wild Ducks Flying Backward,Tom Robbins,3.55,0553383531,9780553383539.0,eng,272.0,5768.0,262.0,8/29/2006;;
8676,Unlimited Power: The New Science Of Personal Achievement,Anthony Robbins/Kenneth H. Blanchard/Jason Winters,4.23,0684845776,9780684845777.0,eng,448.0,25135.0,420.0,12/22/1997;;
8677,Robbins and Cotran Review of Pathology,Edward C. Klatt/Vinay   Kumar,4.33,0721601944,9780721601946.0,en-US,432.0,55.0,6.0,11/12/2004;;
8680,Fierce Invalids Home from Hot Climates,Tom Robbins,4.03,055337933X,9780553379334.0,en-US,445.0,24792.0,1139.0,5/29/2001;;
8682,Jitterbug Perfume,Tom Robbins,4.25,1842430351,9781842430354.0,eng,342.0,54516.0,2721.0,4/9/2001;;
8694,Life  the Universe and Everything (Hitchhiker's Guide to the Galaxy  #3),Douglas Adams,4.2,0345418905,9780345418906.0,eng,224.0,166574.0,2192.0,4/26/2005;;
8698,So Long  and Thanks for All the Fish (Hitchhiker's Guide to the Galaxy  #4),Douglas Adams,4.09,0330491237,9780330491235.0,eng,167.0,93997.0,1394.0,3/8/2002;;
8703,The Restaurant at the End of the Universe (The Hitchhiker's Guide to the Galaxy  #2),Douglas Adams/Martin  Freeman,4.22,0739332074,9780739332078.0,eng,6.0,493.0,95.0,6/1/2006;;
8704,Starship Titanic,Terry Jones/Marie-Catherine Caillava,3.6,2290053651,9782290053652.0,fre,189.0,8790.0,152.0,11/30/2001;;
8706,The Hitchhiker's Guide to the Galaxy (Hitchhiker's Guide to the Galaxy  #1),Douglas Adams,4.22,0330491199,9780330491198.0,eng,180.0,3115.0,306.0,3/8/2002;;
8710,The Illustrated Hitchhiker's Guide To The Galaxy,Douglas Adams,4.35,0517599244,9780517599242.0,eng,96.0,294.0,19.0,10/11/1994;;
8712,Margaret Atwood: The Handmaid's Tale,Hélène Greven-Borde,4.27,2864603497,9782864603498.0,fre,108.0,2122.0,86.0,11/1/1998;;
8713,Point to Point Navigation,Gore Vidal,3.7,0385517211,9780385517218.0,eng,277.0,621.0,90.0,11/7/2006;;
8714,An Inconvenient Truth: The Planetary Emergency of Global Warming and What We Can Do About It,Al Gore,3.77,1594865671,9781594865671.0,eng,328.0,5783.0,433.0,5/24/2006;;
8715,Palimpsest,Gore Vidal,3.99,0140260897,9780140260892.0,en-US,448.0,1485.0,94.0,9/1/1996;;
8716,Lincoln,Gore Vidal,4.21,0375708766,9780375708763.0,eng,672.0,7326.0,430.0,2/15/2000;;
8722,Burr,Gore Vidal,4.07,0375708731,9780375708732.0,eng,430.0,7265.0,526.0,2/15/2000;;
8725,Comfort Me with Apples: More Adventures at the Table,Ruth Reichl,4.04,0375758739,9780375758737.0,eng,302.0,17939.0,947.0,4/9/2002;;
8726,Comfort Me With Apples,Ruth Reichl,4.04,0965193772,9780965193771.0,eng,299.0,15.0,3.0,1/1/2001;;
8737,The Last Temptation of Christ,Nikos Kazantzakis/Peter A. Bien,4.16,068485256X,9780684852560.0,eng,506.0,8966.0,454.0,3/1/1998;;
8738,Her Last Temptation,Leslie Kelly,3.59,0373692285,9780373692286.0,eng,207.0,112.0,5.0,5/31/2005;;
8741,The Last Temptation (Tony Hill & Carol Jordan  #3),Val McDermid,4.01,0312936915,9780312936914.0,eng,496.0,4991.0,271.0,3/1/2005;;
8742,The Last Temptation,Nikos Kazantzakis/Peter A. Bien,4.16,0571178561,9780571178568.0,eng,589.0,114.0,14.0,11/10/1995;;
8744,Desert Dawn,Waris Dirie/Jeanne D'Haem,3.83,1844080080,9781844080083.0,en-GB,240.0,2011.0,84.0,6/1/2004;;
8745,Desert Flower,Waris Dirie/Cathleen Miller,4.15,0688172377,9780688172374.0,eng,240.0,11981.0,735.0,3/15/2011;;
8746,Desert Children,Waris Dirie/Corinna Milborn/Sheelagh Alabaster,3.71,1844082520,9781844082520.0,en-US,240.0,509.0,25.0,11/1/2005;;
8750,L'Aube du désert,Waris Dirie/Jeanne d' Haem,3.83,2226135510,9782226135513.0,fre,288.0,1.0,0.0,11/1/2002;;
8758,The Beach,Joanna Strange,3.84,0582435676,9780582435674.0,eng,112.0,68.0,9.0,2/19/2001;;
8761,The Weekenders: Travels in the Heart of Africa,W.F. Deedes/Sue Ryan/Alex Garland/Tony Hawks/Andrew O'Hagan/Irvine Welsh/Giles Foden/Victoria Glendinning,3.16,0091881803,9780091881801.0,eng,340.0,123.0,12.0,11/8/2001;;
8765,I Feel Bad About My Neck: And Other Thoughts on Being a Woman,Nora Ephron,3.69,0307264556,9780307264558.0,eng,137.0,38506.0,4719.0,8/1/2006;;
8766,Feel the Fear . . . and Do It Anyway,Susan  Jeffers,4.03,0345487427,9780345487421.0,eng,217.0,506.0,53.0,12/26/2006;;
8767,Touch & Feel: Animals Boxed Set,Jennifer Quasha/Deni Brown/Dawn Sirett,4.04,0789488779,9780789488770.0,eng,36.0,24.0,3.0,2/15/2003;;
8768,Today I Feel Silly  Other Moods That Make My Day,Jamie Lee Curtis/Laura Cornell,4.16,0060245603,9780060245603.0,en-US,40.0,4171.0,518.0,7/31/2007;;
8770,My First Word Touch and Feel,Anne Millard,3.79,0789479311,9780789479310.0,eng,12.0,24.0,6.0,9/19/2001;;
8771,When I Feel Angry,Nancy Cote/Cornelia Maude Spelman,3.98,0807588970,9780807588970.0,eng,24.0,113.0,4.0,1/1/2000;;
8773,Violet's House: A Giant Touch-and-Feel Book (Baby Einstein),Julie Aigner-Clark/Nadeem Zaidi,4.0,0786818727,9780786818723.0,eng,10.0,39.0,7.0,11/1/2003;;
8787,The White Masai,Corinne Hofmann/Peter Millar,3.45,0061131520,9780061131523.0,eng,320.0,4504.0,491.0,10/10/2006;;
8797,The Story of a Seagull and the Cat Who Taught Her to Fly,Luis Sepúlveda/Chris Sheban/Margaret Sayers Peden,4.14,0439401879,9780439401876.0,eng,128.0,5097.0,219.0,8/1/2006;;
8799,Ahora sabréis lo que es correr,Dave Eggers/María Victoria Alonso Blanco,3.63,8439710097,9788439710097.0,spa,400.0,3.0,1.0,3/31/2004;;
8801,The Burgess Bird Book for Children,Thornton W. Burgess/Louis Agassiz Fuertes,4.31,0486428400,9780486428406.0,eng,260.0,1253.0,54.0,4/23/2003;;
8804,The Burgess Animal Book for Children,Thornton W. Burgess/Louis Agassiz Fuertes,4.26,0486437450,9780486437453.0,eng,275.0,478.0,30.0,9/10/2004;;
8808,The Adventures of Jimmy Skunk,Thornton W. Burgess/Thea Kliros/Harrison Cady,4.14,0486280233,9780486280233.0,eng,96.0,275.0,19.0,5/20/1994;;
8809,The Wanting Seed,Anthony Burgess,3.71,0393315088,9780393315080.0,en-US,288.0,5423.0,293.0,12/17/1996;;
8810,A Clockwork Orange,Anthony Burgess/Blake Morrison,3.99,0141182601,9780141182605.0,eng,159.0,5366.0,524.0,2/24/2000;;
8811,A Clockwork Orange,Anthony Burgess,3.99,014027409X,9780140274097.0,eng,149.0,1422.0,124.0,9/3/1998;;
8813,Clockwork Orange,Anthony Burgess,3.99,345316413X,9783453164130.0,ger,235.0,65.0,7.0,3/1/2000;;
8814,A Clockwork Orange (Stage Play),Anthony Burgess,3.84,0413735907,9780413735904.0,eng,51.0,28.0,2.0,3/10/2017;;
8818,One Hand Clapping,Anthony Burgess,3.82,0786706317,9780786706310.0,eng,224.0,1008.0,51.0,7/15/1999;;
8820,The Doctor is Sick,Anthony Burgess,3.62,0393316025,9780393316025.0,eng,260.0,966.0,39.0,8/17/1997;;
8822,Earthly Powers,Anthony Burgess,4.16,0099468646,9780099468646.0,eng,649.0,2116.0,157.0,5/6/2004;;
8829,Past Mortem,Ben Elton,3.75,0552771236,9780552771238.0,eng,460.0,4422.0,211.0,5/2/2005;;
8834,This Other Eden,Ben Elton,3.72,055277183X,9780552771832.0,eng,400.0,2292.0,69.0,7/1/2003;;
8840,Saint-Exupéry,Stacy Schiff/Antoine de Saint-Exupéry,4.02,0805079130,9780805079135.0,eng,560.0,208.0,27.0,2/7/2006;;
8848,Le Petit Prince,Antoine de Saint-Exupéry,4.31,2070513289,9782070513284.0,fre,123.0,366.0,19.0,2/1/2004;;
8852,Macbeth,William Shakespeare,3.9,0743477103,9780743477109.0,eng,249.0,592315.0,7791.0,7/1/2013;;
8853,Macbeth,William Shakespeare/Alan Durband,3.9,0812035712,9780812035711.0,eng,224.0,296.0,20.0,4/1/1985;;
8856,Death of a Scriptwriter (Hamish Macbeth  #14),M.C. Beaton,3.79,0446606987,9780446606981.0,eng,198.0,3280.0,188.0,6/1/1999;;
8858,Death of a Poison Pen (Hamish Macbeth  #19),M.C. Beaton,3.83,0446614890,9780446614894.0,en-US,227.0,3318.0,204.0,1/1/2005;;
8859,Death of an Outsider (Hamish Macbeth  #3),M.C. Beaton,3.83,0446614726,9780446614726.0,eng,194.0,5757.0,321.0,7/1/2005;;
8860,Cliffs Notes on Shakespeare's Macbeth,Alex Went,3.59,0764586025,9780764586026.0,en-US,112.0,25.0,2.0,5/30/2000;;
8861,Death of an Addict (Hamish Macbeth  #15),M.C. Beaton,3.8,0446608289,9780446608282.0,eng,214.0,3015.0,167.0,3/1/2001;;
8862,A Year in the Life of William Shakespeare: 1599,James Shapiro,4.09,0060088745,9780060088743.0,eng,333.0,2330.0,252.0,6/13/2006;;
8865,Who Was William Shakespeare?,Celeste Davidson Mannis/John   O'Brien,4.05,0448439042,9780448439044.0,eng,105.0,755.0,94.0,12/28/2006;;
8875,Planet of the Apes,Pierre Boulle/Xan Fielding,3.95,0517209489,9780517209486.0,en-US,192.0,88.0,14.0,6/6/2000;;
8879,Planet of the Apes: Colony,William T. Quick,3.62,0060086211,9780060086213.0,eng,288.0,24.0,1.0,3/25/2003;;
8880,Planet of the Apes  Volume 1: Old Gods,Ian Edginton,2.62,1569716684,9781569716687.0,eng,80.0,8.0,2.0,3/5/2002;;
8881,Planet of the Apes: The Fall,William T. Quick,2.92,0060086203,9780060086206.0,eng,288.0,53.0,2.0,6/4/2002;;
8889,Return to the Planet of the Apes #2: Escape from Terror Lagoon,William Arrow,3.0,0345251679,9780345251671.0,eng,0.0,10.0,2.0,4/12/1976;;
8891,Return to the Planet of the Apes:  Visions from Nowhere,William Arrow,3.33,0345251229,9780345251220.0,eng,183.0,12.0,1.0,6/1/1976;;
8895,Planet of the Apes: The Human War,Ian Edginton,3.28,184023380X,9781840233803.0,eng,72.0,1.0,1.0,7/27/2001;;
8901,Battle for the Planet of the Apes,David Gerrold/John William Corrington/Joyce Hooper Corrington,3.66,0891901639,9780891901631.0,eng,158.0,461.0,10.0,6/1/1973;;
8908,World War Z: An Oral History of the Zombie War,Max Brooks,4.01,0307346609,9780307346605.0,eng,342.0,370331.0,20582.0,9/12/2006;;
8909,The War of the Worlds,H.G. Wells/Arthur C. Clarke,3.82,0375759239,9780375759239.0,eng,192.0,196425.0,4549.0,3/12/2002;;
8910,The Second World War: A Complete History,Martin  Gilbert,4.2,0805076239,9780805076233.0,eng,928.0,919.0,44.0,6/1/2004;;
8915,A Short History of World War II,James L. Stokesbury,3.95,0688085873,9780688085872.0,eng,416.0,472.0,41.0,1/1/1980;;
8916,The Complete Science Fiction Treasury of H.G. Wells,H.G. Wells,4.14,0517052253,9780517052259.0,eng,0.0,45.0,1.0,6/24/1987;;
8917,Best Science Fiction Stories of H. G. Wells,H.G. Wells,3.84,0486215318,9780486215310.0,eng,320.0,60.0,4.0,11/24/2011;;
8919,The Invisible Man,H.G. Wells,3.64,0439574277,9780439574273.0,eng,208.0,333.0,23.0,9/1/2004;;
8921,The Hound of the Baskervilles,Arthur Conan Doyle/Anne Perry/Sidney Paget,4.11,0451528018,9780451528018.0,eng,256.0,191128.0,4802.0,7/1/2001;;
8922,The Hound of the Baskervilles (Sherlock Holmes  #5),Arthur Conan Doyle/David Timson,4.11,9626343346,9789626343340.0,eng,5.0,135.0,20.0,3/30/2005;;
8924,The Hound of the Baskervilles,Arthur Conan Doyle/Pam Smy,4.11,0763630640,9780763630645.0,eng,272.0,66.0,7.0,8/22/2006;;
8927,Sherlock Holmes and the Case of the Hound of the Baskervilles (Great Illustrated Classics),Malvina G. Vogel/Arthur Conan Doyle,4.51,1596792507,9781596792500.0,en-US,237.0,33.0,1.0,1/1/2005;;
8930,Jamie's Italy,Jamie Oliver/David Loftus/Chris Terry,4.01,1401301959,9781401301958.0,eng,320.0,7653.0,90.0,11/14/2006;;
8931,Jamie's Dinners: The Essential Family Cookbook,Jamie Oliver/Marion Deuchars/David Loftus/Chris Terry,4.07,1401301940,9781401301941.0,eng,336.0,4296.0,51.0,11/3/2004;;
8951,The Lake of Souls (Cirque du Freak #10),Darren Shan,4.18,0316016659,9780316016650.0,eng,272.0,18536.0,350.0,9/6/2006;;
8953,Freak the Mighty (Freak The Mighty  #1),Rodman Philbrick,4.01,0439286069,9780439286060.0,eng,169.0,41589.0,4153.0,6/1/2001;;
8954,Word Freak: Heartbreak  Triumph  Genius  and Obsession in the World of Competitive Scrabble Players,Stefan Fatsis,3.82,0142002267,9780142002261.0,eng,372.0,4748.0,597.0,7/30/2002;;
8960,Vampire Mountain (Cirque Du Freak  #4),Darren Shan,4.16,0316905747,9780316905749.0,eng,208.0,26461.0,587.0,9/1/2003;;
8964,Jesus Freaks: Stories of Those Who Stood for Jesus  the Ultimate Jesus Freaks (Jesus Freaks  #1),D.C. Talk/The Voice of the Martyrs,4.21,1577780728,9781577780724.0,eng,383.0,19217.0,271.0,1/15/1999;;
8967,Trials of Death (Cirque Du Freak  #5),Darren Shan,4.25,0316000957,9780316000956.0,eng,202.0,24590.0,525.0,1/18/2008;;
8969,Sister Freaks: Stories of Women Who Gave Up Everything for God,Rebecca St. James/Mary E. DeMuth/Tracey Lawrence/Elizabeth Jusino,4.12,0446695602,9780446695602.0,en-US,320.0,492.0,32.0,10/5/2005;;
8971,Freaks of the Storm: From Flying Cows to Stealing Thunder: The World's Strangest True Weather Stories,Randy Cerveny,3.17,1560258012,9781560258018.0,eng,371.0,139.0,25.0,12/29/2006;;
8974,Freak Show: Presenting Human Oddities for Amusement and Profit,Robert Bogdan,3.88,0226063127,9780226063126.0,eng,336.0,210.0,18.0,5/15/1990;;
8976,Live Like a Jesus Freak: Spend Today as If It Were Your Last,D.C. Talk,4.06,1577782089,9781577782087.0,eng,184.0,591.0,29.0,11/1/2001;;
8978,Freaks!: How to Draw Fantastic Fantasy Creatures,Steve  Miller,4.06,0823016625,9780823016624.0,eng,144.0,31.0,1.0,6/1/2004;;
8988,Jesus Freaks,Andre Duza,3.69,0976249871,9780976249870.0,eng,390.0,55.0,7.0,4/20/2006;;
8991,Category: Freaks  Vol. 1 (Category: Freaks  #1),Sakurako Gokurakuin/Lindsey Johnston,3.55,1588993000,9781588993007.0,eng,184.0,112.0,9.0,7/1/2005;;
9005,Hello Cruel World: 101 Alternatives to Suicide for Teens  Freaks  and Other Outlaws,Kate Bornstein/Sara Quin,4.03,1583227202,9781583227206.0,eng,234.0,1458.0,175.0,5/2/2006;;
9006,Don't Get Too Comfortable: The Indignities of Coach Class  The Torments of Low Thread Count  The Never-Ending Quest for Artisanal Olive Oil  and Other First World Problems,David Rakoff,3.72,0767916034,9780767916035.0,eng,222.0,8410.0,751.0,9/12/2006;;
9010,I Hope They Serve Beer in Hell (Tucker Max  #1),Tucker Max,3.51,0806527285,9780806527284.0,eng,288.0,49042.0,4140.0,1/1/2006;;
9012,Holidays on Ice,David Sedaris,3.92,0316779237,9780316779234.0,eng,134.0,3590.0,251.0,11/1/1998;;
9013,The Long Walk: The True Story of a Trek to Freedom,Sławomir Rawicz,4.21,1592289444,9781592289448.0,eng,256.0,11841.0,1766.0,4/1/2006;;
9014,The Long Walk,Richard Bachman/Stephen King,4.11,0451196716,9780451196712.0,eng,370.0,94303.0,4453.0,4/1/1999;;
9018,Long Walk to Freedom: Autobiography of Nelson Mandela,Nelson Mandela/Kofi Annan/Danny Glover,4.33,1586216880,9781586216887.0,eng,6.0,79.0,16.0,12/1/2004;;
9019,Navajo Long Walk,Nancy M. Armstrong/Paulette Livers-Lambert,3.45,1879373564,9781879373563.0,eng,128.0,56.0,11.0,7/1/1994;;
9030,The Devil in the White City: Murder  Magic and Madness at the Fair that Changed America,Erik Larson,3.99,0553813536,9780553813531.0,eng,496.0,1278.0,207.0,4/1/2004;;
9031,The Devil in the White City Murder  Magic  and Madness at the Fair That Changed America,Erik Larson,3.99,0385602731,9780385602730.0,eng,447.0,283.0,37.0,3/3/2003;;
9051,The Historian's Craft: Reflections on the Nature and Uses of History and the Techniques and Methods of Those Who Write It.,Marc Bloch/Peter Putnam/Joseph Reese Strayer,4.05,0394705122,9780394705125.0,eng,224.0,977.0,71.0,3/12/1964;;
9058,Charles Dickens as a Legal Historian,William Holdsworth,4.0,1886363064,9781886363069.0,eng,166.0,4.0,2.0,2/1/2010;;
9060,The Progressive Historians: Turner  Beard  Parrington (Phoenix Book),Richard Hofstadter,3.89,0226348180,9780226348186.0,eng,498.0,37.0,5.0,11/19/1979;;
9066,What Did the Constitution Mean to Early Americans? (Historians at Work),Edward Countryman,3.29,0312182627,9780312182625.0,eng,169.0,24.0,2.0,1/1/1999;;
9072,The Historian,Elizabeth Kostova/Paul Michael/Justine Eyre,3.78,1415929017,9781415929018.0,eng,26.0,354.0,135.0,12/13/2005;;
9073,See No Evil: The True Story of a Ground Soldier in the CIA's War on Terrorism,Robert B. Baer,3.93,140004684X,9781400046843.0,eng,320.0,4040.0,259.0,1/7/2003;;
9082,In a Dry Season (Inspector Banks  #10),Peter Robinson,4.13,0380794772,9780380794775.0,eng,480.0,6193.0,355.0,7/3/2000;;
9083,Plants and Landscapes for Summer-Dry Climates of the San Francisco Bay Region,East Bay M. U. D. Staff/Nora Harlow/Jill M. Singleton/Barrie D. Coate/Kristine Sandoe,4.3,0975323113,9780975323113.0,en-US,336.0,47.0,8.0,5/1/2004;;
9099,In Focus: National Geographic Greatest Portraits,Leah Bendavid-Val/National Geographic Society,4.24,079227363X,9780792273639.0,eng,504.0,819.0,31.0,10/1/2004;;
9100,Portrait Photographer's Handbook,Bill Hurter,3.62,1584281405,9781584281405.0,eng,128.0,16.0,1.0,9/28/2004;;
9106,Portrait in Death (In Death  #16),J.D. Robb,4.39,0749934425,9780749934422.0,en-US,354.0,142.0,9.0,12/1/2005;;
9107,Posing for Portrait Photography: A Head-To-Toe Guide,Jeff   Smith,3.38,1584281340,9781584281344.0,eng,124.0,51.0,0.0,7/1/2004;;
9118,Le Portrait de Dorian Gray,Oscar Wilde/Michel Etienne/Daniel Mortier,4.08,2266082655,9782266082655.0,fre,345.0,47.0,3.0,6/4/1998;;
9121,The Portrait of Dorian Gray,Oscar Wilde/Elizabeth  Gray,4.08,1842161903,9781842161906.0,eng,51.0,85.0,2.0,10/10/1999;;
9122,The Picture of Dorian Gray,Oscar Wilde/Donald L. Lawler,4.08,0393955680,9780393955682.0,eng,462.0,171.0,13.0,1/1/1988;;
9124,The Picture of Dorian Gray,Oscar Wilde/Michael Gillespie,4.08,0393927547,9780393927542.0,en-US,517.0,663.0,52.0,8/1/2006;;
9125,The Picture of Dorian Gray,Oscar Wilde/Joseph Bristow,4.08,0192807293,9780192807298.0,eng,229.0,1089.0,78.0,11/1/2006;;
9132,An Arab-Syrian Gentleman and Warrior in the Period of the Crusades: Memoirs of Usamah Ibn-Munqidh,Usamah ibn Munqidh/Philip Khuri Hitti/Richard W. Bulliet,3.95,0231121253,9780231121255.0,eng,265.0,68.0,6.0,6/22/2000;;
9140,Technical Manual and Dictionary of Classical Ballet,Gail Grant,4.38,0486218430,9780486218434.0,eng,176.0,393.0,27.0,6/1/1982;;
9141,The Ballet Companion: A Dancer's Guide to the Technique  Traditions  and Joys of Ballet,Eliza Gaynor Minden,4.35,074326407X,9780743264075.0,eng,333.0,524.0,40.0,10/11/2005;;
9143,Ballet Class,John         Green/Caroline Denzler,3.77,0486296385,9780486296388.0,en-US,48.0,13.0,0.0,7/2/1997;;
9144,NYC Ballet Workout,Peter Martins/Paul Kolnik/Richard Corman/Howard  Kaplan,4.01,0688152023,9780688152024.0,eng,208.0,238.0,10.0,1/13/1997;;
9148,The Illustrated Book of Ballet Stories (with CD),Barbara  Newman/Gill Tomblin/Darcey Bussell,4.18,0789460971,9780789460974.0,eng,64.0,64.0,5.0,6/14/2000;;
9149,Lara's Leap of Faith (The Royal Ballet School Diaries  #2),Alexandra Moss/Veronica Bennett,4.07,0448435365,9780448435367.0,eng,144.0,155.0,14.0,1/13/2005;;
9151,Isabelle's Perfect Performance (The Royal Ballet School Diaries  #3),Alexandra Moss,4.06,0448437694,9780448437699.0,eng,144.0,130.0,4.0,5/5/2005;;
9153,The Barefoot Book Of Ballet Stories,Jane Yolen,4.21,1841482641,9781841482644.0,eng,96.0,1.0,0.0,9/1/2004;;
9155,Boys or Ballet? (Royal Ballet School Diaries  #8),Alexandra Moss,3.92,0448442515,9780448442518.0,eng,144.0,93.0,8.0,8/3/2006;;
9156,101 Stories of the Great Ballets: The Scene-by-Scene Stories of the Most Popular Ballets  Old and New,George Balanchine/Francis Mason,4.0,0385033982,9780385033985.0,en-US,560.0,203.0,12.0,5/20/1975;;
9164,Ballet for Dummies,Scott Speck/Evelyn Cisneros,4.01,0764525689,9780764525681.0,eng,348.0,78.0,6.0,10/3/2003;;
9171,Time for Ballet,Adèle Geras/Shelagh McNicholas/Adèle Geras,3.72,0803729782,9780803729780.0,eng,32.0,69.0,13.0,3/30/2004;;
9184,Ballet in Western Culture: A History of Its Origins and Evolution,Carol Lee,3.53,0415942578,9780415942577.0,eng,368.0,17.0,0.0,8/11/2002;;
9186,Angelina's Ballet Class,Katharine Holabird/Helen Craig,3.88,044844013X,9780448440132.0,eng,24.0,73.0,1.0,1/19/2006;;
9203,San Francisco Ballet at Seventy-Five,Janice Ross/Allan Ulrich/Brigitte Lefevre,4.33,0811856984,9780811856980.0,en-US,188.0,6.0,1.0,11/12/2007;;
9216,Ballet and Modern Dance,Susan Au,3.74,0500203520,9780500203521.0,eng,224.0,53.0,6.0,6/17/2002;;
9223,Teaching Classical Ballet,John               White,4.47,081301395X,9780813013954.0,eng,200.0,15.0,1.0,4/20/1996;;
9236,Drat! We're Rats! (Scrambled Legs  #1),Jahnna N. Malcolm,3.69,0970016409,9780970016409.0,eng,160.0,41.0,2.0,9/1/2000;;
9245,Battle of the Bunheads (Scrambled Legs  #2),Jahnna N. Malcolm,3.5,0970016417,9780970016416.0,eng,160.0,44.0,3.0,9/1/2000;;
9253,Blubberina (Scrambled Legs  #5),Jahnna N. Malcolm,3.29,0590428888,9780590428880.0,eng,135.0,13.0,0.0,10/1/1989;;
9262,The Books in My Life,Henry Miller,3.81,0811201082,9780811201087.0,eng,327.0,709.0,29.0,1/17/1969;;
9282,The Smoke Jumper,Nicholas Evans,4.06,0440235162,9780440235163.0,eng,576.0,28769.0,694.0,7/30/2002;;
9288,La casa de los espíritus,Isabel Allende,4.23,9500717638,9789500717632.0,spa,456.0,198.0,18.0,9/1/2000;;
9298,Last Chance Saloon,Marian Keyes,3.81,0060086246,9780060086244.0,en-US,528.0,35784.0,686.0,5/27/2003;;
9299,Anybody Out There? (Walsh Family  #4),Marian Keyes,3.92,0060731303,9780060731304.0,eng,456.0,348.0,45.0,5/9/2006;;
9300,Watermelon (Walsh Family  #1),Marian Keyes,3.78,0099489988,9780099489986.0,eng,520.0,65441.0,1233.0,7/7/2005;;
9301,Rachel's Holiday (Walsh Family  #2),Marian Keyes,3.95,0060090383,9780060090388.0,eng,578.0,55525.0,1223.0,1/23/2007;;
