bookID,title,authors,average_rating,isbn,isbn13,language_code,  num_pages,ratings_count,text_reviews_count,publication_date;;
5370,Amber Brown Is Green With Envy,Paula Danziger/Tony Ross,3.95,0439071712,9780439071710.0,en-GB,160.0,834.0,42.0,8/1/2004;;
5371,Amber Brown Is Not a Crayon,Paula Danziger/Tony Ross,3.84,0142406198,9780142406199.0,eng,96.0,4787.0,189.0,9/7/2006;;
5372,Amber and Ashes (Dragonlance: The Dark Disciple  #1),Margaret Weis,3.87,0786937424,9780786937424.0,eng,336.0,2637.0,64.0,7/1/2005;;
5373,The Waste Lands (The Dark Tower  #3),Stephen King/Ned Dameron,4.24,0747411875,9780747411871.0,eng,509.0,76.0,5.0,11/12/1992;;
5374,The Dragon's Eye (Dragonology Chronicles  #1),Dugald A. Steer/Douglas Carrel,3.82,0763628107,9780763628109.0,eng,221.0,2221.0,113.0,11/14/2006;;
5375,The Dragon's Eye (Erec Rex  #1),Kaza Kingsley/Melvyn Grant,4.0,0978655567,9780978655563.0,eng,341.0,59.0,8.0,10/1/2006;;
5376,Dragon's Eye (Stonefort  #1),James A. Hetley,3.43,0441013724,9780441013722.0,en-US,368.0,133.0,16.0,10/31/2006;;
5396,Dragon's Eye,Christopher Stasheff/William R. Forstchen/Nick DiChario/S.N. Lewitt/Bill Fawcett/Mike Resnick/Mickey Zucker Reichert/S.M. Stirling/Diane Duane/Jody Lynn Nye/Roland J. Green/Teresa Patterson/Judith R. Conly,3.51,0671876090,9780671876098.0,en-GB,279.0,41.0,7.0,7/1/1994;;
5404,Here I Stand: A Life of Martin Luther,Roland H. Bainton,4.08,0452011469,9780452011465.0,eng,336.0,2841.0,224.0,4/1/1995;;
5412,The Stand: Das letzte Gefecht,Stephen King/Joachim Körber,4.34,3404134117,9783404134113.0,ger,1227.0,256.0,16.0,9/1/2003;;
5413,'Salem's Lot,Stephen King/Jerry N. Uelsmann,4.25,0385516487,9780385516488.0,eng,594.0,84123.0,571.0,11/1/2005;;
5414,'Salem's Lot,Stephen King/Ron McLarty,4.02,0743536967,9780743536967.0,eng,17.0,227.0,54.0,1/19/2004;;
5415,'Salem's Lot,Stephen King,4.02,0965772411,9780965772419.0,eng,405.0,1039.0,130.0,10/17/1975;;
5417,Carrie / 'Salem's Lot / The Shining,Stephen King,4.54,0517219026,9780517219027.0,eng,1096.0,13137.0,61.0,7/2/2002;;
5419,'Salem's Lot,Stephen King,4.02,0451092317,9780451092311.0,en-US,427.0,178.0,35.0,11/13/1979;;
5420,'Salem's Lot,Stephen King,4.02,0340770538,9780340770535.0,eng,586.0,25.0,6.0,10/6/2010;;
5427,Orientalism,Edward W. Said,4.08,0141187425,9780141187426.0,eng,396.0,873.0,77.0,8/28/2003;;
5439,Interpreter of Maladies,Jhumpa Lahiri,4.15,0618101365,9780618101368.0,eng,198.0,131876.0,8009.0,5/22/2000;;
5442,The Faiths of the Founding Fathers,David L. Holmes,3.89,0195300920,9780195300925.0,en-US,225.0,461.0,66.0,3/1/2006;;
5452,Girls in Pants: The Third Summer of the Sisterhood (Sisterhood  #3),Ann Brashares,3.83,0553375938,9780553375930.0,eng,338.0,61435.0,1290.0,6/13/2006;;
5453,Forever in Blue: The Fourth Summer of the Sisterhood (Sisterhood  #4),Ann Brashares,3.81,0385729367,9780385729369.0,eng,384.0,62199.0,1613.0,1/9/2007;;
5458,Junie B.  First Grader: Cheater Pants (Junie B. Jones  #21),Barbara Park/Denise Brunkus,4.04,0375823026,9780375823022.0,en-US,86.0,111.0,8.0,4/27/2004;;
5471,Nineteen Eighty-Four,George Orwell/Thomas Pynchon,4.18,0452284236,9780452284234.0,eng,339.0,9910.0,748.0,5/6/2003;;
5472,Animal Farm / 1984,George Orwell/Christopher Hitchens,4.28,0151010269,9780151010264.0,eng,400.0,146659.0,1625.0,6/1/2003;;
5477,1984,George Orwell/Erich Fromm,4.18,0451516753,9780451516756.0,eng,268.0,1322.0,121.0,7/1/1981;;
5478,Nineteen Eighty-Four,George Orwell,4.18,1421808323,9781421808321.0,eng,387.0,215.0,17.0,7/1/2005;;
5479,Brave New World / Brave New World Revisited,Aldous Huxley/Christopher Hitchens,4.16,0060776099,9780060776091.0,eng,340.0,129179.0,1047.0,7/5/2005;;
5480,Brave New World and Brave New World Revisited,Aldous Huxley/Christopher Hitchens,4.16,0060535261,9780060535261.0,eng,340.0,421.0,53.0,6/1/2004;;
5481,Brave New World Revisited,Aldous Huxley,3.95,0060898526,9780060898526.0,eng,123.0,12989.0,740.0,9/5/2006;;
5485,Brave New World,Aldous Huxley,3.99,0060850523,9780060850524.0,eng,259.0,13353.0,1286.0,10/17/2006;;
5486,Andrew Carnegie,David Nasaw,3.99,1594201048,9781594201042.0,eng,896.0,2580.0,205.0,10/24/2006;;
5488,The Cairo Trilogy: Palace Walk / Palace of Desire / Sugar Street (The Cairo Trilogy #1-3),Naguib Mahfouz,4.46,0375413316,9780375413315.0,eng,1313.0,3347.0,245.0,10/16/2001;;
5490,Children of the Alley,Naguib Mahfouz/Peter Theroux,4.1,0385264739,9780385264730.0,eng,464.0,1192.0,131.0,10/18/1996;;
5497,Akhenaten: Dweller in Truth,Naguib Mahfouz/Tagreid Abu-Hassabo,3.81,0385499094,9780385499095.0,eng,168.0,1282.0,139.0,4/4/2000;;
5498,Adrift on the Nile,Naguib Mahfouz/Frances Liardet,3.82,0385423330,9780385423335.0,eng,167.0,411.0,38.0,1/1/1994;;
5499,Midaq Alley,Naguib Mahfouz/Trevor Le Gassick,3.85,0385264763,9780385264761.0,eng,286.0,4815.0,446.0,12/1/1991;;
5502,The Harafish,Naguib Mahfouz/Catherine Cobham/Naguib Mahfouz,4.36,0385423357,9780385423359.0,eng,416.0,590.0,61.0,9/17/1997;;
5503,The Day the Leader Was Killed,Naguib Mahfouz/Surgana/Naguib Mahfouz,3.63,0385499221,9780385499224.0,eng,112.0,809.0,93.0,6/6/2000;;
5508,Anne Frank Beyond the Diary: A Photographic Remembrance,Ruud van der Rol/Rian Verhoeven/Anna Quindlen/Anne Frank/Tony   Langham/Plym Peters,4.27,0140369260,9780140369267.0,eng,113.0,24181.0,242.0,5/1/1995;;
5509,Anne Frank Remembered: The Story of the Woman Who Helped to Hide the Frank Family,Miep Gies/Alison Leslie Gold,4.29,0671662341,9780671662349.0,eng,252.0,55487.0,669.0,4/15/1988;;
5513,The Diary of Anne Frank,Frances Goodrich/Albert Hackett/Wendy Kesselman,4.06,082221718X,9780822217183.0,eng,70.0,1320.0,61.0,10/1/1998;;
5514,Anne Frank: Life in Hiding,Johanna Hurwitz/Vera Rosenberry,3.99,0380732548,9780380732548.0,eng,64.0,152.0,23.0,12/8/1999;;
5518,Cliffs Notes on Hansberry's A Raisin in the Sun,Rosetta James,3.9,0822011085,9780822011088.0,en-GB,80.0,10.0,2.0,8/15/1992;;
5526,Dear John,Nicholas Sparks,4.03,0446528056,9780446528054.0,eng,276.0,502726.0,9645.0,10/30/2006;;
5527,All the King's Men,Robert Penn Warren,4.09,0156004801,9780156004800.0,eng,439.0,47324.0,1720.0,9/1/1996;;
5528,Cliffs notes on Warren's All the King's Men,L. David Allen,3.45,0822001462,9780822001461.0,eng,80.0,3.0,1.0,1/13/1964;;
5530,All the King's Men: Three Stage Versions,Robert Penn Warren/James A. Perkins/James A. Grimshaw,4.0,0820320978,9780820320977.0,eng,264.0,3.0,0.0,7/4/2000;;
5534,Men's Health: Book of Muscle - The World's Most Complete Guide to Building Your Body,Ian King/Lou Schuler/Frederick Deluvier,3.98,1579547699,9781579547691.0,en-US,364.0,256.0,13.0,10/17/2003;;
5544,Surely You're Joking  Mr. Feynman!: Adventures of a Curious Character,Richard P. Feynman,4.28,0393316041,9780393316049.0,eng,391.0,106526.0,3685.0,4/12/1997;;
5545,The Feynman Lectures on Physics  3 Vols,Richard P. Feynman/Robert B. Leighton/Matthew L. Sands,4.6,0201500647,9780201500646.0,en-US,3.0,78.0,7.0,1/1/1989;;
5548,What Do You Care What Other People Think?,Richard P. Feynman,4.27,0393320928,9780393320923.0,eng,256.0,15700.0,556.0,1/11/2001;;
5550,Perfectly Reasonable Deviations from the Beaten Track: Letters of Richard P. Feynman,Richard P. Feynman/Michelle Feynman,4.25,0738206369,9780738206363.0,en-US,512.0,1874.0,93.0,4/5/2005;;
5552,QED: The Strange Theory of Light and Matter,Richard P. Feynman,4.24,0691024170,9780691024172.0,eng,158.0,13463.0,320.0,10/21/1988;;
5554,Kiffe Kiffe Demain (French Edition),Faïza Guène,3.4,0785990232,9780785990239.0,fre,182.0,19.0,1.0,10/1/2005;;
5558,iWoz,Steve Wozniak/Gina Smith,3.87,0393061434,9780393061437.0,en-GB,313.0,3536.0,375.0,9/17/2006;;
5571,Cradle to Cradle: Remaking the Way We Make Things,William McDonough/Michael Braungart,4.11,0865475873,9780865475878.0,eng,193.0,9017.0,820.0,4/22/2002;;
5575,Cradle and All,James Patterson,3.86,0446609404,9780446609401.0,eng,384.0,27869.0,869.0,2/1/2001;;
5585,The Creation of the American Republic  1776-1787,Gordon S. Wood,4.12,0807847232,9780807847237.0,eng,675.0,1792.0,43.0,4/6/1998;;
5587,Power  Faith  and Fantasy: America in the Middle East 1776 to the Present,Michael B. Oren,3.98,0393058263,9780393058260.0,eng,832.0,1510.0,216.0,1/16/2007;;
5595,Problems of the Self: Philosophical Papers 1956 1972,Bernard Williams,3.97,0521290600,9780521290609.0,en-US,276.0,57.0,2.0,3/25/1976;;
5598,Moral Luck: Philosophical Papers 1973-1980,Bernard Williams,4.09,0521286913,9780521286916.0,eng,188.0,114.0,5.0,3/12/1981;;
5599,Ethics and the Limits of Philosophy,Bernard Williams,4.06,067426858X,9780674268586.0,en-US,230.0,556.0,20.0,3/15/1986;;
5606,On Rhetoric and Language: Four Key Dialogues,Jean Nienkamp,4.2,1880393336,9781880393338.0,eng,232.0,10.0,1.0,7/1/1999;;
5635,The Norton Anthology of Modern and Contemporary Poetry,Jahan Ramazani/Richard Ellmann/Robert O'Clair,4.23,039332429X,9780393324297.0,eng,1136.0,286.0,21.0,4/17/2003;;
5653,The Elephant War,Gillian Avery,3.67,1903252040,9781903252048.0,eng,256.0,19.0,3.0,10/1/2000;;
5659,The Wind in the Willows,Kenneth Grahame/Gillian Avery,3.99,0143039091,9780143039099.0,eng,197.0,147748.0,3490.0,10/27/2005;;
5660,The Everyman Anthology of Poetry for Children,Gillian Avery/Everyman's Library/Thomas Benwick,4.14,0679436340,9780679436348.0,eng,379.0,22.0,4.0,9/27/1994;;
5661,Holiday Romance and Other Writings for Children,Charles Dickens,3.32,0460876015,9780460876018.0,eng,368.0,8.0,3.0,5/1/1995;;
5665,Ideas Have Consequences,Richard M. Weaver,4.16,0226876802,9780226876801.0,eng,198.0,970.0,105.0,9/28/1984;;
5671,The Ethics of Rhetoric,Richard M. Weaver,4.14,0961180021,9780961180027.0,eng,240.0,65.0,9.0,11/3/1995;;
5678,Manliness,Harvey Mansfield,3.39,0300106645,9780300106640.0,eng,304.0,177.0,31.0,3/11/2006;;
5685,Anna Karenina,Leo Tolstoy/Richard Pevear/Larissa Volokhonsky,4.05,0142000272,9780142000274.0,en-US,838.0,2415.0,397.0,12/1/2001;;
5691,The Brothers Karamazov,Fyodor Dostoyevsky/Richard Pevear/Larissa Volokhonsky,4.32,0099922800,9780099922803.0,eng,796.0,443.0,55.0,1/16/1992;;
5693,Selected Stories of Anton Chekhov,Anton Chekhov/Richard Pevear/Larissa Volokhonsky,4.35,0553381008,9780553381009.0,eng,467.0,27027.0,466.0,10/31/2000;;
5694,Mother Maria Skobtsova: Essential Writings,Maria Skobtsova/Richard Pevear,4.31,1570754365,9781570754364.0,eng,192.0,62.0,9.0,10/1/2002;;
5696,What is Art?,Leo Tolstoy/Richard Pevear/Larissa Volokhonsky,3.72,0140446427,9780140446425.0,eng,230.0,127.0,24.0,8/31/1995;;
5697,The Complete Short Novels,Anton Chekhov/Richard Pevear/Larissa Volokhonsky,4.47,140003292X,9781400032921.0,eng,548.0,10580.0,118.0,8/18/2005;;
5698,The Double and The Gambler,Fyodor Dostoyevsky/Richard Pevear/Larissa Volokhonsky,4.16,0375719016,9780375719011.0,eng,344.0,2486.0,99.0,1/16/2007;;
5700,The Adolescent,Fyodor Dostoyevsky/Richard Pevear/Larissa Volokhonsky,3.94,0375719008,9780375719004.0,eng,647.0,3568.0,159.0,12/7/2004;;
5712,If I Die in a Combat Zone,Tim O'Brien,3.95,0007162995,9780007162994.0,eng,208.0,11.0,0.0,4/7/2003;;
5713,If I Die In A Combat Zone,Tim O'Brien,3.95,0586087990,9780586087992.0,eng,208.0,53.0,4.0,4/24/1995;;
5720,Rainbow Six (John Clark  #2; Jack Ryan Universe  #10),Tom Clancy/David Dukes,4.09,0425170349,9780425170342.0,eng,912.0,40815.0,908.0,9/1/1999;
5728,Child of War  Woman of Peace,Le Ly Hayslip/James Hayslip/Jenny Wurts,3.8,0385471475,9780385471473.0,eng,388.0,186.0,22.0,12/1/1993;;
5729,When Heaven and Earth Changed Places: A Vietnamese Woman's Journey from War to Peace,Le Ly Hayslip/Jay Wurts,4.12,0452271681,9780452271685.0,eng,400.0,2593.0,252.0,11/1/1993;;
5735,Philip Vera Cruz: A Personal History of Filipino Immigrants and the Farmworkers Movement,Craig Scharlin/Lilia V. Villanueva,4.22,0295979844,9780295979847.0,en-US,208.0,86.0,4.0,6/1/2000;;
5736,Coming of Age in Mississippi: The Classic Autobiography of a Young Black Girl in the Rural South,Anne Moody,4.13,0385337817,9780385337816.0,eng,424.0,7072.0,453.0,2/3/2004;;
5738,I'm Too Young To Be Seventy,Judith Viorst/Laura Gibson,3.93,0743267745,9780743267748.0,en-US,64.0,237.0,45.0,10/12/2005;;
5743,Seventy-Seven Clocks (Bryant & May #3),Christopher Fowler,3.89,0553587153,9780553587159.0,eng,496.0,2095.0,188.0,11/29/2005;;
5752,The Blank Slate: The Modern Denial of Human Nature,Steven Pinker,4.08,0142003344,9780142003343.0,eng,528.0,18793.0,721.0,8/26/2003;;
5755,The Language Instinct: How the Mind Creates Language,Steven Pinker,4.03,0060958332,9780060958336.0,eng,448.0,15441.0,693.0,11/7/2000;;
5756,Learnability and Cognition: The Acquisition of Argument Structure,Steven Pinker/Jacques A. Mehler,3.75,0262660733,9780262660730.0,eng,432.0,50.0,1.0,8/28/1991;;
5759,Fight Club,Chuck Palahniuk,4.19,0393327345,9780393327342.0,eng,218.0,388782.0,9654.0,10/17/2005;;
5766,BSD Hacks,Lavigne,3.8,0596006799,9780596006792.0,en-US,450.0,42.0,5.0,5/31/2004;;
5770,The Design and Implementation of the 4.3BSD UNIX Operating System,Samuel J. Leffler/Marshall Kirk McKusick/Michael J. Karels,4.26,0201061961,9780201061963.0,eng,471.0,27.0,2.0,6/1/1989;;
5776,Choke,Stuart Woods,3.84,0061094226,9780061094224.0,eng,352.0,2288.0,96.0,9/12/1996;;
5777,Choke Point: A Brinker Mystery (Brinker P.I.),James C. Mitchell,3.22,0312315325,9780312315320.0,eng,272.0,3.0,0.0,10/5/2004;;
5787,The Aleph and Other Stories,Jorge Luis Borges/Andrew Hurley,4.38,0142437883,9780142437889.0,eng,210.0,20259.0,460.0,7/27/2004;;
5794,El Aleph,Jorge Luis Borges,4.38,9500425998,9789500425995.0,spa,253.0,146.0,9.0,9/1/2007;;
5797,Vanity Fair,William Makepeace Thackeray/John Carey,3.79,0141439831,9780141439839.0,eng,867.0,102877.0,2286.0,1/30/2003;;
5799,Vanity Fair,William Makepeace Thackeray/Nicholas Dames,3.79,1593080719,9781593080716.0,eng,696.0,553.0,97.0,11/1/2003;;
5800,Vanity Fair,William Makepeace Thackeray,3.79,0140620850,9780140620856.0,eng,672.0,296.0,34.0,10/3/1998;;
5805,V for Vendetta,Alan Moore/David   Lloyd,4.25,1401207928,9781401207922.0,eng,296.0,234954.0,4058.0,11/1/2005;;
5809,V.,Thomas Pynchon/Carlos Martín Ramírez,3.96,2020418770,9782020418775.0,fre,640.0,15174.0,561.0,1/2/2001;;
5810,Girl in the Shadows (Shadows  #2),V.C. Andrews,3.81,1416500529,9781416500520.0,en-US,400.0,5.0,1.0,3/7/2006;;
5812,V for Vendetta,Steve Moore/Lilly Wachowski/Lana Wachowski/Alan Moore,4.15,1416516999,9781416516996.0,eng,358.0,2980.0,118.0,3/1/2006;;
5813,Heaven (Casteel  #1),V.C. Andrews,4.03,0671010050,9780671010058.0,eng,464.0,13.0,0.0,4/1/1997;;
5814,Slow Learner: Early Stories,Thomas Pynchon,3.5,0099532514,9780099532514.0,eng,208.0,3169.0,161.0,2/16/1995;;
5816,A Gravity's Rainbow Companion: Sources and Contexts for Pynchon's Novel,Steven Weisenburger,4.01,0820328073,9780820328072.0,eng,424.0,152.0,26.0,11/1/2006;;
5821,Casino Royale,Ian Fleming,3.73,0141187581,9780141187587.0,eng,181.0,371.0,43.0,6/3/2004;;
5824,Casino Royale,Anthony Hern/Ian Fleming/Henry Gammidge/John McLusky,3.7,1840238437,9781840238433.0,eng,96.0,110.0,10.0,6/1/2005;;
5826,Bel Canto,Ann Patchett,3.93,0060838728,9780060838720.0,eng,352.0,218195.0,13012.0,8/2/2005;;
5835,Guerilla Film Makers Movie Blueprint,Chris          Jones/Jonathan Newman/Cara Williams,4.2,0826414532,9780826414533.0,eng,608.0,50.0,1.0,6/20/2003;;
5838,Mini-Manual of the Urban Guerrilla,Carlos Marighella,3.31,1894925025,9781894925020.0,en-US,66.0,127.0,13.0,9/9/2002;;
5843,The Career Programmer: Guerilla Tactics for an Imperfect World (Expert's Voice),Christopher   Duncan,3.13,1590596242,9781590596241.0,en-US,264.0,37.0,7.0,2/1/2006;;
5845,A Bend in the River,V.S. Naipaul,3.77,0330487140,9780330487146.0,eng,326.0,13147.0,690.0,5/10/2002;;
5848,The Middle Passage,V.S. Naipaul,3.61,0375708340,9780375708343.0,en-US,256.0,461.0,35.0,1/8/2002;;
5851,Magic Seeds,V.S. Naipaul,3.13,0375707271,9780375707278.0,eng,280.0,715.0,104.0,11/8/2005;;
5853,Half a Life,V.S. Naipaul,3.25,037570728X,9780375707285.0,eng,224.0,3078.0,301.0,4/23/2009;;
5855,North of South: An African Journey,Shiva Naipaul,3.89,0140188266,9780140188264.0,eng,352.0,279.0,33.0,9/26/1996;;
5863,V.S. Naipaul,Bruce Alvin King,2.0,1403904561,9781403904560.0,eng,240.0,0.0,0.0,10/10/2003;;
5874,Regeneration Through Violence: The Mythology of the American Frontier  1600–1860,Richard Slotkin,4.3,0806132299,9780806132297.0,eng,670.0,163.0,16.0,4/15/2000;;
5875,Regeneration (Species Imperative  #3),Julie E. Czerneda,4.13,0756403456,9780756403454.0,en-US,543.0,54.0,2.0,5/2/2006;;
5877,The Regeneration Trilogy (Regeneration  #1-3),Pat Barker,4.38,0670869295,9780670869299.0,eng,592.0,1588.0,95.0,1/1/1996;;
5880,The Sparrow (The Sparrow  #1),Mary Doria Russell,4.16,0552997773,9780552997775.0,eng,506.0,664.0,103.0,11/1/1997;;
5881,The Age of Bronze (Pirates of the Caribbean: Jack Sparrow  #5),Rob Kidd/Walt Disney Company,4.05,1423101685,9781423101680.0,eng,144.0,548.0,14.0,12/1/2006;;
5882,The Sword of Cortés (Pirates of the Caribbean: Jack Sparrow  #4),Rob Kidd/Jean-Paul Orpinas/Walt Disney Company,3.98,1423100611,9781423100614.0,en-US,122.0,644.0,14.0,10/1/2006;;
5883,The Pirate Chase (Pirates of the Caribbean: Jack Sparrow  #3),Rob Kidd/Walt Disney Company,3.89,1423100204,9781423100201.0,eng,119.0,730.0,20.0,8/1/2006;;
5885,The Siren Song (Pirates of the Caribbean: Jack Sparrow  #2),Rob Kidd/Jean-Paul Orpinas,3.86,1423100190,9781423100195.0,eng,123.0,859.0,27.0,6/1/2006;;
5886,The Coming Storm (Pirates of the Caribbean: Jack Sparrow  #1),Rob Kidd/Jean-Paul Orpinas,3.83,1423100182,9781423100188.0,en-US,135.0,1414.0,82.0,6/1/2006;;
5890,The Woman in White,Wilkie Collins/Matthew Sweet,4.0,0141439610,9780141439617.0,eng,672.0,108060.0,5168.0,2/27/2003;;
5891,The Woman in White,Wilkie Collins,4.0,0486440966,9780486440965.0,eng,504.0,136.0,28.0,4/15/2005;;
5893,The Woman in White,Wilkie Collins/Maria K. Bachman/Don Richard Cox,4.0,1551116448,9781551116440.0,eng,696.0,122.0,15.0,4/20/2006;;
5896,The Woman in White,Wilkie Collins/Camille Cauti,4.0,1593082800,9781593082802.0,eng,635.0,624.0,136.0,4/25/2005;;
5898,The Lord of the Rings (The Lord of the Rings  #1-3),J.R.R. Tolkien,4.5,0007136587,9780007136582.0,eng,1200.0,682.0,43.0,9/16/2002;;
5901,The 9/11 Commission Report: Final Report of the National Commission on Terrorist Attacks Upon the United States,National Commission on Terrorist Attacks Upon The United States,3.6,0393060411,9780393060416.0,eng,624.0,146.0,16.0,10/17/2004;;
5907,The Hobbit  or There and Back Again,J.R.R. Tolkien,4.27,0618260307,9780618260300.0,eng,366.0,2530894.0,32871.0,8/15/2002;;
5910,The Annotated Hobbit,J.R.R. Tolkien/Douglas A. Anderson,4.27,0007137273,9780007137275.0,eng,411.0,121.0,16.0,4/7/2003;;
5911,Poems From The Hobbit,J.R.R. Tolkien,4.3,0618009345,9780618009343.0,eng,57.0,169.0,5.0,12/13/1999;;
5912,The Hobbit: Or There and Back Again,J.R.R. Tolkien,4.27,1594130051,9781594130052.0,eng,481.0,276.0,43.0,9/1/2003;;
5915,The Hobbit,J.R.R. Tolkien,4.27,0261103288,9780261103283.0,eng,277.0,3213.0,329.0,9/17/2007;;
5918,Ruthless Rhymes for Heartless Homes and More Ruthless Rhymes,Harry Graham/Frank J. Moore/D. Streamer,3.86,0486402185,9780486402185.0,eng,64.0,44.0,10.0,6/19/2013;;
5931,The Essential Neruda: Selected Poems,Pablo Neruda/Mark Eisner/Lawrence Ferlinghetti/Robert Hass/Stephen Mitchell/Alastair Reid/Forrest Gander/Jack Hirschman/Stephen Kessler/John Felstiner,4.46,0872864286,9780872864283.0,eng,200.0,5149.0,210.0,4/1/2004;;
5932,Twenty Love Poems and a Song of Despair,Pablo Neruda/W.S. Merwin/Cristina García,4.3,0143039962,9780143039969.0,eng,70.0,37942.0,1105.0,12/26/2006;;
5934,Veinte poemas de amor y una canción desesperada; Cien sonetos de amor,Pablo Neruda,4.3,1400001447,9781400001446.0,eng,160.0,1120.0,54.0,1/22/2002;
5937,Love,Pablo Neruda,4.46,0786881488,9780786881482.0,eng,43.0,1333.0,68.0,6/16/1995;;
5942,Anil's Ghost,Michael Ondaatje,3.57,0375724370,9780375724374.0,eng,311.0,13022.0,1013.0,4/24/2001;;
5952,Waiting for My Cats to Die: A Memoir,Stacy Horn,3.67,0312287445,9780312287443.0,eng,320.0,177.0,28.0,1/17/2002;;
5957,Narcissus and Goldmund,Hermann Hesse/Leila Vennewitz,4.2,0720608724,9780720608724.0,eng,288.0,175.0,9.0,6/1/1993;;
5966,Edward Lear's Book of Nonsense: With Lear's Original Illustrations,Edward Lear/Simcha Shtull,3.65,1888297018,9781888297010.0,eng,46.0,71.0,8.0,11/1/1995;;
5969,A Sparrow Falls (Courtney #3),Wilbur Smith,4.19,0312940688,9780312940683.0,eng,640.0,5019.0,91.0,1/2/2007;;
5970,Providence of a Sparrow: Lessons from a Life Gone to the Birds,Chris Chester,4.33,1400033853,9781400033850.0,eng,304.0,228.0,44.0,4/13/2004;;
5974,Sparrow Hawk Red,Ben Mikaelsen,3.79,0786811056,9780786811052.0,eng,185.0,1.0,0.0,4/1/1995;;
5975,The Fall of a Sparrow,Robert Hellenga,3.69,0684850273,9780684850276.0,eng,464.0,824.0,89.0,7/6/1999;;
5976,The Bluebird and the Sparrow (Women of the West  #10),Janette Oke,3.83,0764202537,9780764202537.0,en-US,251.0,78.0,9.0,8/1/2006;;
5981,Journey of the Sparrows,Fran Leeper Buss/Daisy Cubias,3.69,0142302090,9780142302095.0,eng,160.0,205.0,25.0,12/30/2002;;
5984,Aleutian Sparrow,Karen Hesse/Evon Zerbetz/Kim McGillivray,3.78,1416903275,9781416903277.0,eng,160.0,710.0,146.0,6/1/2005;;
5985,An Episode of Sparrows,Rumer Godden,4.21,1590171241,9781590171240.0,en-GB,247.0,900.0,126.0,10/31/2004;;
5989,Li Po and Tu Fu: Poems,Li Bai/Du Fu/Arthur Cooper/Shui Chien-Tung,4.14,0140442723,9780140442724.0,eng,256.0,389.0,28.0,4/26/1973;;
5991,混血王子的背叛 (哈利波特  #6),J.K. Rowling/J.K.羅琳/皇冠編譯組/張定綺/彭倩文/趙丕慧/林靜華,4.57,9573321742,9789573321743.0,zho,735.0,75.0,0.0,10/1/2005;;
6003,火盃的考驗 (哈利波特  #4),J.K. Rowling/J.K.羅琳/彭倩文,4.56,9573318318,9789573318316.0,zho,768.0,91.0,2.0,12/8/2001;;
6008,Five T'ang Poets,Wang Wei/Li Bai/Li Ho/Li Shang-yin/David        Young,4.3,093244055X,9780932440556.0,eng,184.0,169.0,21.0,10/8/1990;;
6038,The End of Obscenity: The Trials of Lady Chatterley  Tropic of Cancer  and Fanny Hill,Charles Rembar,3.88,0060970618,9780060970611.0,eng,528.0,11.0,0.0,12/1/1986;;
6048,Juniper,Monica Furlong,4.16,0394832205,9780394832203.0,eng,198.0,112.0,7.0,2/24/2004;;
6057,The Long Road Back: A Survivor's Guide to Anorexia,Judy Tam Sargent/Sonia Nordenson,3.2,1880823195,9781880823194.0,en-GB,194.0,30.0,3.0,10/1/1998;;
6058,The Road Back,Erich Maria Remarque,4.32,1931541744,9781931541749.0,eng,352.0,3146.0,99.0,12/1/2001;;
6066,Robinson Crusoe,Daniel Defoe/L.J. Swingle,3.67,1593080115,9781593080112.0,eng,312.0,350.0,49.0,4/1/2003;;
6069,Achilles in Vietnam: Combat Trauma and the Undoing of Character,Jonathan Shay,4.25,0684813211,9780684813219.0,en-US,272.0,1130.0,110.0,10/1/1995;;
6076,The Work of Mourning,Jacques Derrida/Pascale-Anne Brault/Michael Naas,4.2,0226142817,9780226142814.0,eng,272.0,167.0,7.0,9/15/2003;;
6089,Transform Your Life: A step-by-step programme for change,Diana Cooper,4.0,0749919442,9780749919443.0,eng,176.0,6.0,0.0,10/29/1998;;
6106,A Short History of Byzantium,John Julius Norwich,4.09,0679772693,9780679772699.0,eng,496.0,1772.0,142.0,12/29/1998;;
6107,The Middle Sea: A History of the Mediterranean,John Julius Norwich,3.85,0701176083,9780701176082.0,eng,588.0,662.0,53.0,10/31/2006;;
6109,A History of Venice,John Julius Norwich,4.2,0679721975,9780679721970.0,eng,673.0,1422.0,93.0,6/18/1989;;
6110,The Normans in Sicily: The Normans in the South 1016-1130 and the Kingdom in the Sun 1130-1194,John Julius Norwich,4.34,0140152121,9780140152128.0,eng,816.0,268.0,16.0,9/1/2004;;
6112,Siddhartha,Hermann Hesse/Susan Bernofsky/Tom Robbins,4.02,0679643362,9780679643364.0,eng,129.0,888.0,60.0,7/18/2006;;
6115,Siddhartha,Hermann Hesse/Joachim Neugroschel/Ralph Freedman,4.02,0142437182,9780142437186.0,eng,132.0,1104.0,114.0,12/31/2002;;
6129,Siddhartha,Hermann Hesse,4.02,2253008486,9782253008484.0,fre,160.0,590.0,29.0,10/31/1975;;
6138,The Moonstone,Wilkie Collins/Carolyn G. Heilbrun,3.91,0375757856,9780375757853.0,eng,528.0,59709.0,2819.0,9/11/2001;;
6140,The Moonstone,Wilkie Collins,3.91,0140620133,9780140620139.0,en-GB,464.0,349.0,44.0,10/24/1998;;
6144,The Moonstone,Wilkie Collins/P.D. James,3.91,0192100289,9780192100283.0,eng,576.0,74.0,6.0,6/10/1999;;
6148,Ride of the Second Horseman: The Birth and Death of War,Robert L. O'Connell,4.29,0195119207,9780195119206.0,eng,320.0,13.0,0.0,10/19/1997;;
6149,Beloved,Toni Morrison,3.83,1400033411,9781400033416.0,eng,324.0,282045.0,9004.0,6/8/2004;;
6150,Cry  the Beloved Country,Alan Paton,3.9,074326195X,9780743261951.0,eng,316.0,54558.0,2937.0,11/25/2003;;
6151,Life of the Beloved: Spiritual Living in a Secular World,Henri J.M. Nouwen,4.28,0824519868,9780824519865.0,eng,160.0,7551.0,498.0,10/1/2002;;
6152,Come Away My Beloved,Frances J. Roberts,4.58,1593109156,9781593109158.0,eng,192.0,8.0,0.0,10/1/2005;;
6155,Israel  My Beloved,Kay Arthur,4.16,0736903704,9780736903707.0,eng,448.0,681.0,83.0,3/15/2001;;
6156,Beloved Bride: The Letters of Stonewall Jackson to His Wife,Bill Potter/Stephen Lang,4.1,1929241631,9781929241637.0,eng,156.0,137.0,18.0,4/10/2003;;
6157,The Search for the Beloved: Journeys in Mythology and Sacred Psychology (Inner Workbook),Jean Houston,3.95,0874778719,9780874778717.0,en-US,272.0,18.0,2.0,6/30/1997;;
6159,Reservation Blues,Sherman Alexie,3.98,0802141900,9780802141903.0,eng,306.0,11163.0,772.0,2/7/2005;;
6163,The Border Trilogy: All the Pretty Horses  The Crossing  Cities of the Plain,Cormac McCarthy,4.44,0375407936,9780375407932.0,eng,1040.0,4589.0,252.0,9/28/1999;;
6167,Music & Silence,Rose Tremain,3.95,0743418263,9780743418263.0,eng,485.0,2923.0,214.0,5/1/2001;;
6173,The Periodic Table,Primo Levi,4.21,0140296611,9780140296617.0,en-GB,194.0,101.0,10.0,1/1/2009;;
6174,Survival in Auschwitz,Primo Levi/Stuart J. Woolf/Philip Roth,4.32,0684826801,9780684826806.0,eng,187.0,29099.0,900.0,9/1/1995;;
6175,The Reawakening,Primo Levi/Stuart J. Woolf,4.29,0684826356,9780684826356.0,eng,230.0,1269.0,67.0,12/1/1995;;
