bookID,title,authors,average_rating,isbn,isbn13,language_code,  num_pages,ratings_count,text_reviews_count,publication_date;;
2538,El hombre duplicado,José Saramago/Pilar del Río,3.89,8466312803,9788466312806.0,spa,380.0,1295.0,106.0,9/1/2004;;
2539,Ensayo sobre la lucidez,José Saramago/Pilar del Río,3.8,8466314741,9788466314749.0,spa,461.0,1744.0,124.0,1/1/2005;;
2541,La caverna,José Saramago/Pilar del Río,3.84,846630679X,9788466306799.0,spa,441.0,842.0,69.0,2/1/2003;;
2542,The History of the Siege of Lisbon,José Saramago/Giovanni Pontiero,3.81,0156006243,9780156006248.0,eng,314.0,331.0,62.0,9/1/1998;;
2543,Las intermitencias de la muerte,José Saramago/Pilar del Río,4.0,9587043642,9789587043648.0,spa,274.0,2862.0,306.0,12/1/2005;;
2545,The Treasured Writings of Kahlil Gibran,Kahlil Gibran,4.42,089009389X,9780890093894.0,eng,902.0,1432.0,45.0,10/6/2009;;
2547,The Prophet,Kahlil Gibran/جبران خليل جبران/Jihad El,4.23,000100039X,9780001000391.0,eng,127.0,184293.0,5418.0,1/1/2010;;
2549,A Tear and a Smile,Kahlil Gibran/جبران خليل جبران/H.M. Nahmad/Robert Hillyer,4.03,0394448049,9780394448046.0,eng,228.0,2094.0,104.0,6/27/1950;;
2551,On the Road,Jack Kerouac,3.63,0143036386,9780143036388.0,eng,320.0,488.0,39.0,9/6/2005;;
2552,On the Road,Jack Kerouac/Ann Charters,3.63,0141182679,9780141182674.0,eng,281.0,5575.0,502.0,2/24/2000;;
2557,De Kooning: An American Master,Mark Stevens/Annalyn Swan,4.11,0375711163,9780375711169.0,eng,732.0,2732.0,105.0,4/4/2006;;
2560,Willem de Kooning: Late Paintings,Julie Sylvester/David Sylvester,5.0,382960226X,9783829602266.0,eng,83.0,1.0,0.0,9/1/2006;;
2567,Aké: The Years of Childhood,Wole Soyinka,3.93,0679725407,9780679725404.0,eng,230.0,1284.0,90.0,10/23/1989;;
2581,Ready for Anything: 52 Productivity Principles for Getting Things Done,David    Allen,3.85,0143034545,9780143034544.0,eng,165.0,3832.0,178.0,12/28/2004;;
2584,The Facilitator's Book of Questions: Tools for Looking Together at Student and Teacher Work,David  Allen/Tina Blythe/Gene Thompson-Grove,4.0,0807744689,9780807744680.0,eng,142.0,54.0,4.0,4/29/2004;;
2586,Sun Tzu and the Art of Business: Six Strategic Principles for Managers,Sun Tzu/Mark McNeilly,3.89,0195137892,9780195137897.0,eng,272.0,125.0,13.0,4/1/2000;;
2595,Marketing Warfare,Al Ries/Jack Trout,4.11,0071460829,9780071460828.0,eng,216.0,942.0,59.0,12/13/2005;;
2612,The Tipping Point: How Little Things Can Make a Big Difference,Malcolm Gladwell,3.97,0316346624,9780316346627.0,eng,301.0,633037.0,11898.0,1/7/2002;;
2613,Unleashing the Ideavirus: Stop Marketing AT People! Turn Your Ideas into Epidemics by Helping Your Customers Do the Marketing thing for You.,Seth Godin/Malcolm Gladwell,3.98,0786887176,9780786887170.0,en-US,234.0,4600.0,88.0,10/10/2001;;
2615,The Innovator's Dilemma: The Revolutionary Book that Will Change the Way You Do Business,Clayton M. Christensen/L.J. Ganser,3.99,0060521996,9780060521998.0,eng,286.0,32079.0,752.0,1/7/2003;;
2619,Great Expectations,Charles Dickens/David Trotter/Charlotte Mitchell,3.77,0141439564,9780141439563.0,eng,512.0,14228.0,668.0,12/31/2002;;
2626,Great Expectations: Authoritative Text  Backgrounds  Contexts  Criticism,Charles Dickens/Edgar Rosenberg,3.77,0393960692,9780393960693.0,eng,776.0,573.0,38.0,1/19/1999;;
2646,Luther and Erasmus: Free Will and Salvation (Library of Christian Classics),Erasmus/Martin Luther/Philip S. Watson/E. Gordon Rupp,3.8,0664241581,9780664241582.0,eng,364.0,108.0,13.0,1/1/1969;;
2654,To Kill a Mockingbird,Harper Lee,4.27,0060935464,9780060935467.0,eng,323.0,10524.0,898.0,7/5/2005;;
2655,To Kill a Mockingbird,Harper Lee/Sissy Spacek,4.27,0060888695,9780060888695.0,eng,11.0,697.0,180.0,8/22/2006;;
2661,To Kill a Mockingbird,Harper Lee,4.27,0061205699,9780061205699.0,en-US,323.0,271.0,34.0,10/17/2006;;
2673,The Wealthy Barber: Everyone's Common-Sense Guide to Becoming Financially Independent,David H. Chilton,4.02,0761501665,9780761501664.0,eng,199.0,66.0,4.0,9/20/1995;;
2677,A Modest Proposal and Other Satirical Works,Jonathan Swift,4.05,0486287599,9780486287591.0,eng,64.0,13562.0,141.0,2/2/1996;;
2678,Gulliver's Travels / A Modest Proposal,Jonathan Swift/Jesse Gale,3.79,1416500391,9781416500391.0,eng,416.0,2161.0,50.0,8/1/2005;;
2680,Empire 2.0: A Modest Proposal for a United States of the West (Terra Nova),Xavier de C./Xavier de C./Joseph Rowe,4.67,1556434952,9781556434952.0,eng,144.0,3.0,0.0,5/4/2004;;
2686,The Bostonians,Henry James/R.D. Gooder,3.59,0192834428,9780192834423.0,eng,504.0,85.0,12.0,7/23/1998;;
2687,Novels 1896–1899: The Other House / The Spoils of Poynton / What Maisie Knew / The Awkward Age,Henry James/Myra Jehlen,4.28,1931082308,9781931082303.0,eng,1035.0,25.0,4.0,3/10/2003;;
2688,Novels 1901–1902: The Sacred Fount / The Wings of the Dove,Henry James/Leo Bersani,4.63,193108288X,9781931082884.0,eng,713.0,27.0,3.0,2/2/2006;;
2692,Complete Stories 1892–1898,Henry James/John Hollander/David Bromwich,4.22,1883011094,9781883011093.0,eng,958.0,198.0,7.0,1/1/1996;;
2696,The Canterbury Tales,Geoffrey Chaucer/Nevill Coghill,3.49,0140424385,9780140424386.0,eng,504.0,168559.0,2365.0,1/30/2003;;
2698,The Canterbury Tales,Geoffrey Chaucer/David  Wright,3.49,019283360X,9780192833600.0,eng,465.0,257.0,22.0,7/9/1998;;
2701,The Canterbury Tales (original-spelling edition),Geoffrey Chaucer/Jill Mann,3.49,014042234X,9780140422344.0,enm,1254.0,792.0,59.0,4/7/2005;;
2702,Chaucer's Canterbury Tales (Selected): An Interlinear Translation,Geoffrey Chaucer/Vincent Foster Hopper,3.8,0812000390,9780812000399.0,eng,530.0,73.0,5.0,12/31/1977;;
2705,Oxford Guides to Chaucer: The Canterbury Tales,Helen  Cooper,4.02,0198711557,9780198711551.0,eng,456.0,84.0,4.0,5/23/1996;;
2706,Love Visions,Geoffrey Chaucer/Brian Stone,3.61,0140444084,9780140444087.0,eng,272.0,70.0,6.0,5/26/1983;;
2710,Chaucer's Canterbury Tales,Geoffrey Chaucer,3.49,0671475029,9780671475024.0,eng,383.0,36.0,5.0,1/28/1964;;
2711,The Riverside Chaucer,Geoffrey Chaucer/Larry Dean Benson/F.N. Robinson,4.18,0395290317,9780395290316.0,enm,1327.0,7760.0,152.0,12/12/1987;;
2713,The Portable Chaucer,Geoffrey Chaucer/Theodore Morrison,3.86,0140150811,9780140150810.0,eng,611.0,70.0,8.0,5/26/1977;;
2715,Salt: A World History,Mark Kurlansky,3.74,0142001619,9780142001615.0,eng,484.0,50335.0,3012.0,1/28/2003;;
2718,Salt in His Shoes: Michael Jordan in Pursuit of a Dream,Deloris Jordan/Kadir Nelson/Roslyn M. Jordan,4.2,0689834195,9780689834196.0,eng,32.0,1178.0,173.0,11/1/2003;;
2719,The Book of Salt,Monique Truong,3.52,0618446885,9780618446889.0,eng,261.0,4411.0,629.0,6/15/2004;;
2722,Cities of Salt (مدن الملح #1),Abdul Rahman Munif/Peter Theroux,4.13,039475526X,9780394755267.0,eng,627.0,856.0,105.0,7/17/1989;;
2723,The Years of Rice and Salt,Kim Stanley Robinson,3.73,0553580078,9780553580075.0,eng,763.0,9344.0,995.0,6/3/2003;;
2725,Illuminations: Essays and Reflections,Walter Benjamin/Hannah Arendt/Harry Zohn/Leon Wieseltier,4.29,0805202412,9780805202410.0,eng,288.0,9254.0,194.0,1/13/1969;;
2727,Saul Steinberg: Illuminations,Saul Steinberg/Joel Smith/Charles Simic,4.51,0300115865,9780300115864.0,eng,288.0,39.0,5.0,11/1/2006;;
2731,Advanced Global Illumination,Philip Dutre,4.5,1568813074,9781568813073.0,eng,366.0,17.0,2.0,8/30/2006;;
2735,Snow Falling On Cedars,David Guterson,3.83,074754655X,9780747546559.0,eng,404.0,588.0,46.0,10/21/1999;;
2743,The Lost Boy (Dave Pelzer #2),Dave Pelzer,4.1,1558745157,9781558745155.0,eng,331.0,52028.0,2513.0,8/1/1997;;
2745,Real Boys: Rescuing Our Sons from the Myths of Boyhood,William S. Pollack/Mary Pipher,3.83,0805061835,9780805061833.0,en-US,480.0,1397.0,128.0,5/10/1999;;
2749,Microserfs,Douglas Coupland,3.88,0007179812,9780007179817.0,eng,371.0,442.0,38.0,1/1/2008;;
2756,New Media Language,Jean Aitchison/Diana M. Lewis,3.0,0415283043,9780415283045.0,eng,209.0,2.0,0.0,5/22/2003;;
2761,The Denial of Death,Ernest Becker/Sam Keen/Daniel Goleman,4.16,0684832402,9780684832401.0,eng,336.0,6599.0,635.0,5/8/1997;;
2767,A People's History of the United States,Howard Zinn,4.08,0060838655,9780060838652.0,eng,729.0,167321.0,4711.0,8/2/2005;;
2768,A People's History of the United States,Howard Zinn/Kathy Emery/Ellen Gordon Reeves,4.08,1565848268,9781565848269.0,eng,619.0,39.0,3.0,7/1/2003;;
2770,A People's History of the United States: The Civil War to the Present,Howard Zinn/Kathy Emery/Ellen Gordon Reeves,4.0,1565847253,9781565847255.0,eng,496.0,22.0,0.0,8/1/2003;;
2778,Graphic Design: A Concise History (World of Art),Richard Hollis,4.0,0500203474,9780500203477.0,en-US,232.0,675.0,12.0,5/17/2002;;
2781,Immigrant Acts: On Asian American Cultural Politics,Lisa Lowe,4.0,0822318644,9780822318644.0,eng,272.0,206.0,9.0,10/21/1996;;
2785,The Old Way of Seeing: How Architecture Lost Its Magic - And How to Get It Back,Jonathan Hale,3.92,039574010X,9780395740101.0,eng,256.0,81.0,12.0,9/1/1995;;
2794,The Crying of Lot 49,Thomas Pynchon,3.69,006091307X,9780060913076.0,eng,152.0,57011.0,3332.0,10/17/2006;;
2802,E=mc²: A Biography of the World's Most Famous Equation,David Bodanis,4.09,0425181642,9780425181645.0,eng,337.0,6368.0,321.0,10/1/2000;;
2804,Passionate Minds,David Bodanis,4.1,0307237206,9780307237200.0,en-US,373.0,717.0,112.0,10/10/2006;;
2810,Christian Mythmakers: C.S. Lewis  Madeleine L'Engle  J.R.R. Tolkien  George MacDonald  G.K. Chesterton  Charles Williams  Dante Alighieri  John Bunyan  Walter Wangerin  Robert Siegel  and Hannah Hurnard,Rolland Hein/Clyde S. Kilby,3.93,094089548X,9780940895485.0,eng,303.0,448.0,18.0,12/1/2002;;
2811,A House Like a Lotus (O'Keefe Family  #3),Madeleine L'Engle,3.76,0440936853,9780440936855.0,eng,307.0,3976.0,163.0,11/1/1985;;
2814,The Rock That Is Higher: Story as Truth,Madeleine L'Engle,4.12,0877887268,9780877887263.0,eng,320.0,496.0,48.0,3/19/2002;;
2815,The Glorious Impossible,Madeleine L'Engle/Giotto di Bondone,4.25,0671686909,9780671686901.0,eng,64.0,367.0,38.0,9/30/1990;;
2817,A Full House: An Austin Family Christmas (Austin Family  #5.6),Madeleine L'Engle/Mary Chambers,3.98,0877880204,9780877880202.0,eng,48.0,235.0,4.0,3/7/2000;;
2819,A Circle of Quiet (Crosswicks Journals #1),Madeleine L'Engle,4.21,0062545035,9780062545039.0,en-CA,246.0,5236.0,506.0,1/1/1984;;
2820,The Birth of Tragedy and Other Writings,Friedrich Nietzsche/Raymond Geuss/Ronald Speirs,4.04,0521639875,9780521639873.0,eng,204.0,388.0,23.0,4/22/1999;;
2821,The Birth of Tragedy/The Genealogy of Morals,Friedrich Nietzsche/Francis Golffing,4.01,0385092105,9780385092104.0,en-US,320.0,843.0,42.0,5/7/1990;;
2822,The Birth of Tragedy,Friedrich Nietzsche,3.98,1419154079,9781419154072.0,eng,84.0,32.0,0.0,6/17/2004;;
2823,The Birth of Tragedy,Friedrich Nietzsche/Michael Tanner/Shaun Whiteside,3.98,0140433392,9780140433395.0,en-US,160.0,10147.0,301.0,11/27/2003;;
2826,Birth Of A Tragedy: Kashmir 1947,Alastair Lamb,4.0,0907129072,9780907129073.0,eng,179.0,9.0,2.0,3/14/2008;;
2834,The Tragedy of Pudd'nhead Wilson/Those Extraordinary Twins,Mark Twain/David Lionel Smith/Sherley Anne Williams,3.79,0195114159,9780195114157.0,eng,512.0,3664.0,58.0,3/6/1997;;
2835,The Tragedy of Pudd'nhead Wilson,Mark Twain/Michael Prichard,3.79,140015068X,9781400150687.0,eng,0.0,3.0,0.0,1/1/2003;;
2836,Bridge to Terabithia,Katherine Paterson/Donna Diamond,4.0,0060734019,9780060734015.0,en-US,191.0,1811.0,152.0,7/1/2008;;
2843,Literature Circle Guide: Bridge to Terabithia: Everything You Need For Successful Literature Circles That Get Kids Thinking  Talking  Writing—and Loving Literature,Tara MacCarthy,5.0,0439271711,9780439271714.0,eng,32.0,4.0,1.0,1/1/2002;;
2847,Bread and Roses  Too,Katherine Paterson,3.76,0618654798,9780618654796.0,eng,275.0,2018.0,294.0,9/4/2006;;
2851,The Invisible Child,Katherine Paterson,4.27,0525464824,9780525464822.0,eng,266.0,99.0,27.0,12/31/2001;;
2855,A Short History of Decay,Emil M. Cioran/Richard Howard,4.25,1559704640,9781559704649.0,eng,186.0,1771.0,99.0,9/15/1998;;
2860,Scholar of Decay (Ravenloft  #14),Tanya Huff,3.46,078690206X,9780786902064.0,eng,313.0,38.0,1.0,5/1/2000;;
2864,Girl with a Pearl Earring,Tracy Chevalier,3.88,0452284937,9780452284937.0,eng,233.0,1162.0,127.0,9/30/2003;;
2868,The Golden Tulip,Rosalind Laker,3.94,0385415605,9780385415606.0,eng,585.0,29.0,4.0,9/1/1991;;
2871,Burning Bright,Tracy Chevalier,3.36,052594978X,9780525949787.0,eng,320.0,10919.0,1113.0,3/20/2007;;
2872,Falling Angels,Tracy Chevalier,3.58,0452283205,9780452283206.0,eng,336.0,20321.0,1214.0,9/24/2002;;
2873,The Virgin Blue,Tracy Chevalier,3.66,0452284449,9780452284449.0,eng,304.0,26029.0,1588.0,6/24/2003;;
2875,Wenn Engel fallen,Tracy Chevalier,3.58,3471772537,9783471772539.0,ger,384.0,6.0,1.0,2/1/2002;;
2877,Tom Hunter: Living in Hell and Other Stories,Tom Hunter/Tracy Chevalier/Colin Wiggins,3.64,1857093313,9781857093315.0,en-GB,80.0,42.0,0.0,3/8/2006;;
2879,Bleach  Volume 15,Tite Kubo,4.42,1421506130,9781421506135.0,eng,208.0,19945.0,76.0,10/3/2006;;
2880,Bleach  Volume 01,Tite Kubo,4.22,1591164419,9781591164418.0,eng,200.0,140403.0,1063.0,5/19/2004;;
2881,Bleach  Volume 14,Tite Kubo,4.38,1421506122,9781421506128.0,eng,208.0,10356.0,79.0,8/1/2006;;
2882,Bleach  Volume 11,Tite Kubo,4.36,1421502712,9781421502717.0,eng,208.0,8773.0,84.0,2/7/2006;;
2883,Bleach  Volume 12,Tite Kubo,4.36,1421504030,9781421504032.0,eng,208.0,8948.0,86.0,4/4/2006;;
2885,DEATH NOTE デスノート 1,Tsugumi Ohba/Takeshi Obata/大場 つぐみ/小畑 健,4.43,4088736214,9784088736211.0,jpn,195.0,227.0,38.0,4/2/2004;;
2886,Death Note  Vol. 4: 恋心 (Death Note  #4),Tsugumi Ohba/Takeshi Obata,4.39,4088736710,9784088736716.0,jpn,204.0,452.0,13.0,11/11/2004;;
2887,Death Note  Vol. 3: 激走 (Death Note  #3),Tsugumi Ohba/Takeshi Obata,4.43,4088736524,9784088736525.0,jpn,194.0,400.0,11.0,9/3/2004;;
2893,Love Artist (Harlequin Romance #2860),Valerie Parv,3.25,0373028601,9780373028603.0,eng,187.0,3.0,1.0,7/24/1987;;
2895,Perfume: The Story of a Murderer,Patrick Süskind/John E. Woods,4.02,0307277763,9780307277763.0,eng,255.0,1124.0,191.0,2/13/2001;;
2896,Das Parfum. Die Geschichte eines Mörders,Patrick Süskind,4.02,3257228007,9783257228007.0,ger,321.0,9674.0,343.0,6/1/1994;;
2898,Three Stories and a Reflection,Patrick Süskind,3.57,0747534934,9780747534938.0,eng,128.0,24.0,3.0,11/13/1997;;
2899,The Pigeon,Patrick Süskind,3.68,0140105832,9780140105834.0,eng,77.0,6254.0,423.0,6/29/1989;;
2900,The Story of Mr Sommer,Patrick Süskind/Jean-Jacques Sempé,3.84,0747566755,9780747566755.0,eng,128.0,2061.0,104.0,11/3/2003;;
2906,Bleach―ブリーチ― 1 [Burīchi 1] (Bleach  #1),Tite Kubo,4.22,4088732138,9784088732138.0,jpn,189.0,41.0,3.0,1/5/2002;;
2907,Bleach  Tome 1: The Death and the Strawberry,Tite Kubo,4.22,2723442276,9782723442275.0,fre,192.0,54.0,4.0,7/2/2003;;
2912,Escape from Fire Mountain (World of Adventure  #3),Gary Paulsen/Steve Chorney,3.67,0440410258,9780440410256.0,eng,80.0,114.0,17.0,1/1/1995;;
2917,How Angel Peterson Got His Name,Gary Paulsen,3.93,0440229359,9780440229353.0,eng,111.0,1177.0,218.0,8/10/2004;;
2920,Tucket's Travels: Francis Tucket's Adventures In The West  1847-1849 (The Tucket Adventures  #1-5),Gary Paulsen,4.44,0440419670,9780440419679.0,en-US,560.0,557.0,46.0,9/9/2003;;
2921,Chicago Blues: The City and the Music,Mike  Rowe/Ronald Radano,3.92,0306801450,9780306801457.0,eng,226.0,25.0,2.0,8/22/1981;;
2923,Winterdance: The Fine Madness of Running the Iditarod,Gary Paulsen,4.26,0156001454,9780156001458.0,eng,272.0,5437.0,830.0,2/17/1995;;
2928,Brian's Winter,Gary Paulsen,4.01,0385321988,9780385321983.0,en-US,133.0,76.0,12.0,1/1/1996;;
2932,Robinson Crusoe (Robinson Crusoe #1),Daniel Defoe/Virginia Woolf,3.67,0375757325,9780375757327.0,eng,320.0,209122.0,4131.0,6/12/2001;;
2933,Robinson Crusoe,Daniel Defoe/John J. Richetti,3.67,0141439823,9780141439822.0,eng,286.0,1507.0,142.0,3/27/2003;;
2934,Robinson Crusoe,Daniel Defoe/Michael Shinagel,3.67,0393964523,9780393964523.0,en-US,436.0,585.0,63.0,12/19/1994;;
2937,Robinson Crusoe,Daniel Defoe/Avi,3.67,0689844085,9780689844089.0,eng,482.0,204.0,32.0,7/1/2001;;
2940,Robinson Crusoe,Daniel Defoe,3.67,1587263882,9781587263880.0,eng,288.0,311.0,18.0,7/14/2006;;
2942,A General History of the Pyrates,Daniel Defoe/Manuel Schonhorn/Charles   Johnson,3.72,0486404889,9780486404882.0,eng,733.0,577.0,36.0,1/26/1999;;
2949,Huck Finn & Tom Sawyer among the Indians & Other Unfinished Stories (Mark Twain Library),Mark Twain/Paul Baender/Dahlia Armon/Walter Blair,3.85,0520238958,9780520238954.0,eng,389.0,5.0,0.0,3/15/2003;;
2952,Huck Finn and Tom Sawyer Among the Indians,Mark Twain/Lee Nelson,3.57,1555176801,9781555176808.0,eng,277.0,242.0,29.0,4/22/2003;;
2953,Huck Finn/Pudd'nhead Wilson/No 44 Mysterious Stranger other Writings,Mark Twain/Guy Cardwell/Louis J. Budd,4.06,1883011884,9781883011888.0,en-US,808.0,33.0,3.0,8/1/2000;;
2956,The Adventures of Huckleberry Finn (Adventures of Tom and Huck  #2),Mark Twain/Guy Cardwell/John Seelye/Walter Trier,3.82,0142437174,9780142437179.0,eng,327.0,1049912.0,11391.0,12/31/2002;;
2958,Adventures of Huckleberry Finn,Mark Twain/E.W. Kemble,3.82,0486443221,9780486443225.0,eng,368.0,144.0,17.0,5/6/2005;;
2960,Adventures of Huckleberry Finn,Mark Twain/George Saunders,3.82,0375757376,9780375757372.0,eng,244.0,687.0,37.0,8/14/2001;;
2962,The Annotated Huckleberry Finn,Mark Twain/Michael Patrick Hearn/E.W. Kemble,3.82,0393020398,9780393020397.0,eng,656.0,185.0,18.0,10/17/2001;;
2965,The Wit and Wisdom of Mark Twain,Mark Twain,4.2,0486406644,9780486406640.0,eng,64.0,970.0,53.0,12/23/1998;;
2967,Mark Twain's Helpful Hints for Good Living: A Handbook for the Damned Human Race,Mark Twain/Lin Salamo/Victor Fischer/Michael B. Frank,3.86,0520242459,9780520242456.0,eng,221.0,513.0,71.0,10/18/2004;;
2968,The Complete Short Stories of Mark Twain,Mark Twain/Charles Neider,4.28,0553211951,9780553211955.0,eng,848.0,5710.0,142.0,3/1/1984;;
2971,The Autobiography of Mark Twain,Mark Twain/Charles Neider,4.05,0060955422,9780060955427.0,eng,508.0,2871.0,209.0,11/28/2000;;
2973,Collected Tales  Sketches  Speeches  & Essays 1891–1910,Mark Twain/Louis J. Budd,4.39,0940450739,9780940450738.0,eng,1050.0,207.0,10.0,10/15/1992;;
2978,Lost Horizon,James Hilton,3.92,0060594527,9780060594527.0,eng,241.0,11892.0,955.0,6/15/2004;;
2988,Louisa May Alcott's Christmas Treasury,Louisa May Alcott/C. Michael Dudash/Stephen W. Hines,3.96,1589199502,9781589199507.0,eng,282.0,715.0,44.0,6/1/2002;;
2997,My Secret Garden: Women's Sexual Fantasies,Nancy Friday,3.68,0671019872,9780671019877.0,eng,361.0,1817.0,123.0,10/28/2003;;
2998,The Secret Garden,Frances Hodgson Burnett,4.13,0517189607,9780517189603.0,eng,331.0,764134.0,11796.0,9/1/1998;;
3003,The Secret Garden,Frances Hodgson Burnett/Sandra M. Gilbert,4.13,0451528832,9780451528834.0,eng,281.0,1739.0,116.0,7/1/2003;;
3004,The Secret Garden,Martha Hailey DuBose/Frances Hodgson Burnett/Lucy Corvino/Arthur Pober,4.33,1402713193,9781402713194.0,eng,160.0,1653.0,76.0,3/1/2005;;
3006,The Secret Garden,Frances Hodgson Burnett/Alison Lurie,4.13,0142437050,9780142437056.0,en-GB,288.0,517.0,13.0,1/30/2003;;
3008,A Little Princess,Frances Hodgson Burnett/Nancy Bond,4.2,0142437018,9780142437018.0,eng,242.0,238192.0,4392.0,2/26/2002;;
3011,Waiting for the Party: The Life of Frances Hodgson Burnett  1849-1924,Ann Thwaite,3.8,0879237902,9780879237905.0,eng,274.0,23.0,7.0,9/1/1994;;
3014,The Secret Garden Cookbook: Recipes Inspired by Frances Hodgson Burnett's The Secret Garden,Amy Cotler/Frances Hodgson Burnett/Prudence See,4.3,0060277408,9780060277406.0,eng,128.0,150.0,23.0,3/19/1999;;
3023,Basic Economics: A Citizen's Guide to the Economy,Thomas Sowell,4.32,0465081452,9780465081455.0,eng,448.0,5899.0,475.0,12/24/2003;;
3025,Basic Economics: A Common Sense Guide to the Economy,Thomas Sowell,4.32,0465002609,9780465002603.0,eng,627.0,328.0,43.0,4/3/2007;;
3040,Black Rednecks and White Liberals,Thomas Sowell,4.38,1594030863,9781594030864.0,eng,372.0,2579.0,301.0,6/1/2005;;
3041,Applied Economics: Thinking Beyond Stage One,Thomas Sowell,4.14,0465081436,9780465081431.0,eng,256.0,1546.0,122.0,11/13/2003;;
3042,Knowledge And Decisions,Thomas Sowell,4.39,0465037380,9780465037384.0,eng,422.0,766.0,47.0,10/4/1996;;
3047,A Conflict of Visions: Ideological Origins of Political Struggles,Thomas Sowell,4.31,0465081428,9780465081424.0,eng,304.0,1797.0,166.0,1/3/2002;;
3051,Sir Gawain and the Green Knight,Selina Shirley Hastings/Juan Wijngaard,3.91,0744520053,9780744520057.0,eng,29.0,65.0,9.0,6/27/1991;;
3053,Alcoholics Anonymous,Alcoholics Anonymous,4.45,0916856593,9780916856595.0,eng,250.0,22.0,0.0,8/1/1993;;
3055,Alcoholics Anonymous,Alcoholics Anonymous,4.45,1893007162,9781893007161.0,en-US,576.0,495.0,30.0,2/10/2002;;
3056,The Twelve Steps & Twelve Traditions of Overeaters Anonymous,Overeaters Anonymous,4.36,0960989862,9780960989867.0,en-US,221.0,213.0,10.0,1/1/1993;;
3061,The Natural Way to Draw,Kimon Nicolaides/Mamie Harmon,3.9,0395530075,9780395530078.0,en-US,240.0,39369.0,80.0,2/1/1990;;
3065,Natural Health  Natural Medicine,Andrew Weil,4.11,0618479031,9780618479030.0,en-US,448.0,580.0,41.0,12/9/2004;;
3066,The Fixer,Bernard Malamud/Jonathan Safran Foer,3.96,0374529388,9780374529383.0,eng,335.0,8624.0,409.0,5/5/2004;;
3067,The Complete Stories,Bernard Malamud/Robert Giroux,4.22,0374525757,9780374525750.0,en-US,656.0,712.0,51.0,10/12/1998;;
3068,The Assistant,Bernard Malamud/Jonathan Rosen,3.89,0374504849,9780374504847.0,en-US,246.0,8073.0,319.0,7/7/2003;;
3070,Conversations with Bernard Malamud (Literary Conversations),Lawrence M. Lasher,4.0,0878054901,9780878054909.0,eng,184.0,4.0,0.0,3/1/1991;;
3072,The Tenants,Bernard Malamud/Aleksandar Hemon,3.65,0374521026,9780374521028.0,eng,248.0,662.0,50.0,9/18/2003;;
3075,Enchanted April: Acting Edition,Matthew Barber/Elizabeth von Arnim,3.61,0822219751,9780822219750.0,eng,73.0,67.0,6.0,4/7/2004;;
3084,April  May und June,Elizabeth von Arnim,3.88,345833422X,9783458334224.0,ger,88.0,0.0,0.0,4/1/1995;;
3087,A Room with a View,E.M. Forster,3.91,1420925431,9781420925432.0,eng,119.0,128596.0,3422.0,1/1/2005;;
3088,A Room with a View / Howards End,E.M. Forster/Benjamin DeMott,4.1,0451521412,9780451521415.0,eng,449.0,2450.0,113.0,2/4/1986;;
3100,E.M. Forster: Critical Guidebook,Lionel Trilling/E.M. Forster,3.51,0811202100,9780811202107.0,eng,208.0,6.0,0.0,1/17/1971;;
3101,The Longest Journey,E.M. Forster/Gilbert Adair/Elizabeth Heine,3.48,0141441488,9780141441481.0,eng,396.0,1665.0,125.0,7/27/2006;;
3102,Howards End,E.M. Forster,3.96,0486424545,9780486424545.0,eng,246.0,54765.0,1437.0,10/29/2002;;
3103,Maurice,E.M. Forster,4.03,0393310329,9780393310320.0,eng,256.0,21997.0,1005.0,12/17/2005;;
3104,E. M. Forster: A Life,P.N. Furbank,4.14,0156286513,9780156286510.0,eng,648.0,141.0,11.0,5/2/1994;;
3105,Howards End,E.M. Forster,3.96,0141183357,9780141183350.0,eng,352.0,368.0,26.0,9/28/2000;;
3107,The Sixteen Pleasures,Robert Hellenga,3.59,0385314698,9780385314695.0,eng,384.0,2699.0,336.0,5/1/1995;;
3113,Revolutionary Characters: What Made the Founders Different,Gordon S. Wood,3.97,1594200939,9781594200939.0,eng,336.0,3259.0,187.0,5/18/2006;;
3117,The Rescue (Kidnapped  #3),Gordon Korman,4.11,0439847796,9780439847797.0,eng,140.0,1864.0,117.0,9/1/2006;;
3119,Hunting the Hunter (On the Run  #6),Gordon Korman,4.21,0439651417,9780439651417.0,eng,151.0,1928.0,85.0,2/1/2006;;
3120,Public Enemies (On The Run  #5),Gordon Korman,4.19,0439651409,9780439651400.0,eng,150.0,2050.0,76.0,12/1/2005;;
3130,Runaway Bride,Deborah  Gordon,4.25,0380777584,9780380777587.0,eng,390.0,8.0,0.0,9/28/1994;;
3142,The Bridge over the Drina,Ivo Andrić/William H. McNeill,4.33,1860460585,9781860460586.0,eng,314.0,254.0,35.0,4/5/1995;;
3144,Drina Dances in Paris,Jean Estoril,4.16,0750000333,9780750000338.0,eng,194.0,14.0,4.0,4/1/1991;;
3145,Drina Ballerina,Jean Estoril,4.16,0750005947,9780750005944.0,eng,188.0,8.0,1.0,1/17/1991;;
3147,Le Pont sur la Drina,Ivo Andrić/Pascale Delpech,4.33,225393321X,9782253933212.0,fre,384.0,69.0,10.0,7/5/1999;;
3152,Drina Dances in Italy,Jean Estoril,4.08,0750012633,9780750012638.0,eng,191.0,21.0,0.0,8/31/1992;;
3155,Drina Goes on Tour,Jean Estoril/Mabel Esther Allan,4.26,0750002468,9780750002462.0,eng,188.0,112.0,7.0,10/20/1991;;
3156,Drina Dances in Madeira,Jean Estoril/Mabel Esther Allan,4.09,0750002425,9780750002424.0,eng,164.0,139.0,6.0,2/6/1991;;
3167,Phaedrus/Apology/Crito/Symposium,Plato/Benjamin Jowett,3.0,1420926845,9781420926842.0,en-US,144.0,19.0,0.0,1/1/2006;;
3207,The Dialogues of Plato  Volume 1: Euthyphro  Apology  Crito  Meno  Gorgias  Menexenus,Plato/Reginald E. Allen,4.17,0300044887,9780300044881.0,eng,352.0,114.0,11.0,9/10/1989;;
3231,Gorgias/Timaeus,Plato/Benjamin Jowett,3.74,0486427595,9780486427591.0,eng,256.0,34.0,5.0,7/15/2003;;
3232,Minor Works: On Colours/On Things Heard/Physiognomics/On Plants/On Marvellous Things Heard/Mechanical Problems/On Indivisible Lines/The...Gorgias,Aristotle/W.S. Hett,4.57,0674993381,9780674993389.0,grc,528.0,14.0,0.0,6/28/1963;;
3248,Aristophanes I: Clouds/Wasps/Birds,Aristophanes/Peter Meineck/Ian C. Storey,3.77,0872203603,9780872203600.0,eng,480.0,100.0,9.0,9/1/1998;;
3254,The Trojan Women,Euripides/Gilbert Murray,3.89,1420927329,9781420927320.0,eng,80.0,4577.0,126.0,1/1/2006;;
3258,Greek Tragedies  Volume 2,David Grene/Richmond Lattimore/Aeschylus/Sophocles/Euripides,4.29,0226307751,9780226307756.0,eng,304.0,327.0,12.0,2/15/1960;;
3273,Moloka'i (Moloka'i #1),Alan Brennert,4.17,0312304358,9780312304355.0,eng,405.0,91395.0,8192.0,10/4/2004;;
3280,Teaching with the Brain in Mind,Eric Jensen,4.11,1416600302,9781416600305.0,eng,186.0,592.0,49.0,6/15/2005;;
3283,Introducing Mind and Brain (Introducing...),Angus Gellatly/Oscar Zárate/Richard Appignanesi,3.54,1840466383,9781840466386.0,en-GB,176.0,26.0,1.0,5/10/2001;;
